id;google_id;json_volume;previewlink;title;author_id;author_name;publisher;publisherdate;description;categories;pages;rating;language;image
305;1uFSAgAAQBAJ;https://www.googleapis.com/books/v1/volumes/1uFSAgAAQBAJ;http://books.google.com/books?id=1uFSAgAAQBAJ&printsec=frontcover&dq=Ernest+Hemingway&hl=&cd=33&source=gbs_api;Hemingway on Hunting;182;Ernest Hemingway;Simon and Schuster;2014-05-22;"Ernest Hemingway’s lifelong zeal for hunting is reflected in his masterful works of fiction, from his famous account of an African safari in “The Short Happy Life of Francis Macomber” to passages about duck hunting in Across the River and into the Trees. For Hemingway, hunting was more than just a passion; it was a means through which to explore our humanity and man’s relationship to nature. Courage, awe, respect, precision, patience—these were the virtues that Hemingway honored in the hunter, and his ability to translate these qualities into prose has produced some of the strongest accounts of hunting of all time. Hemingway on Hunting offers the full range of Hemingway’s writing about the hunting life. With selections from his best-loved novels and stories, along with journalistic pieces from such magazines as Esquire and Vogue, this spectacular collection is a must-have for anyone who has ever tasted the thrill of the hunt—in person or on the page.";{Fiction};336;3;en;http://books.google.com/books/content?id=1uFSAgAAQBAJ&printsec=frontcover&img=1&zoom=1&edge=curl&source=gbs_api
306;sO9BfTuoGucC;https://www.googleapis.com/books/v1/volumes/sO9BfTuoGucC;http://books.google.com/books?id=sO9BfTuoGucC&printsec=frontcover&dq=Ernest+Hemingway&hl=&cd=34&source=gbs_api;For Whom the Bell Tolls;182;Ernest Hemingway;Simon and Schuster;2002-07-25;"In 1937 Ernest Hemingway traveled to Spain to cover the civil war there for the North American Newspaper Alliance. Three years later he completed the greatest novel to emerge from ""the good fight,"" For Whom the Bell Tolls. The story of Robert Jordan, a young American in the International Brigades attached to an antifascist guerilla unit in the mountains of Spain, it tells of loyalty and courage, love and defeat, and the tragic death of an ideal. In his portrayal of Jordan's love for the beautiful Maria and his superb account of El Sordo's last stand, in his brilliant travesty of La Pasionaria and his unwillingness to believe in blind faith, Hemingway surpasses his achievement in The Sun Also Rises and A Farewell to Arms to create a work at once rare and beautiful, strong and brutal, compassionate, moving and wise. ""If the function of a writer is to reveal reality,"" Maxwell Perkins wrote to Hemingway after reading the manuscript, ""no one ever so completely performed it."" Greater in power, broader in scope, and more intensely emotional than any of the author's previous works, it stands as one of the best war novels of all time.";{Fiction};501;5;en;http://books.google.com/books/content?id=sO9BfTuoGucC&printsec=frontcover&img=1&zoom=1&edge=curl&source=gbs_api
307;ML4uKwK1fEoC;https://www.googleapis.com/books/v1/volumes/ML4uKwK1fEoC;http://books.google.com/books?id=ML4uKwK1fEoC&printsec=frontcover&dq=Ernest+Hemingway&hl=&cd=35&source=gbs_api;Reading Desire;194;Debra Moddelmog;Cornell University Press;1999;"Whether revered for his masculinity, condemned as an icon of machismo, or perceived as possessing complex androgynous characteristics, Ernest Hemingway is acknowledged to be one of the most important twentieth-century American novelists. For Debra A. Moddelmog, the intense debate about the nature of his identity reveals how critics' desires give shape to an author's many guises. In her provocative book, Moddelmog interrogates Hemingway's persona and work to show how our perception of the writer is influenced by society's views on knowledge, power, and sexuality. She believes that recent attempts to reinvent Hemingway as man and as artist have been circumscribed by their authors' investment in heterosexist ideology; she seeks instead to situate Hemingway's sexual identity in the interface between homosexuality and heterosexuality. Moddelmog looks at how sexual orientation, gender, race, nationality, able-bodiedness—and the intersections of these elements—contribute to the formation of desire. Ultimately, she makes a far-reaching and suggestive argument about multiculturalism and the canons of American letters, asserting that those who teach literature must be aware of the politics and ethics of the authorial constructions they promote.";"{""Biography & Autobiography""}";189;5;en;http://books.google.com/books/content?id=ML4uKwK1fEoC&printsec=frontcover&img=1&zoom=1&edge=curl&source=gbs_api
308;--FSAgAAQBAJ;https://www.googleapis.com/books/v1/volumes/--FSAgAAQBAJ;http://books.google.com/books?id=--FSAgAAQBAJ&printsec=frontcover&dq=Ernest+Hemingway&hl=&cd=36&source=gbs_api;Hemingway on Fishing;182;Ernest Hemingway;Simon and Schuster;2014-05-22;From childhood on, Ernest Hemingway was a passionate fisherman. He fished the lakes and creeks near the family’s summer home at Walloon Lake, Michigan, and his first stories and pieces of journalism were often about his favorite sport. Here, collected for the first time in one volume, are all of his great writings about the many kinds of fishing he did—from angling for trout in the rivers of northern Michigan to fishing for marlin in the Gulf Stream. In A Moveable Feast, Hemingway speaks of sitting in a café in Paris and writing about what he knew best—and when it came time to stop, he “did not want to leave the river.” The story was the unforgettable classic “Big Two-Hearted River,” and from its first words we do not want to leave the river either. He also wrote articles for The Toronto Star on fishing in Canada and Europe and, later, articles for Esquire about his growing passion for big-game fishing. Two of his last books, The Old Man and the Sea and Islands in the Stream, celebrate his vast knowledge of the ocean and his affection for its great denizens. Hemingway on Fishing is an encompassing, diverse, and fascinating assemblage. From the early Nick Adams stories and the memorable chapters on fishing the Irati River in The Sun Also Rises to such late novels as Islands in the Stream, this collection traces the evolution of a great writer’s passion, the range of his interests, and the sure use he made of fishing, transforming it into the stuff of great literature. Anglers and lovers of great writing alike will welcome this important collection.;{Fiction};272;5;en;http://books.google.com/books/content?id=--FSAgAAQBAJ&printsec=frontcover&img=1&zoom=1&edge=curl&source=gbs_api
333;gPq7jwEACAAJ;https://www.googleapis.com/books/v1/volumes/gPq7jwEACAAJ;http://books.google.com/books?id=gPq7jwEACAAJ&dq=Alexander+Dumas&hl=&cd=21&source=gbs_api;"Episodes from Alexander Dumas ""Les Trois Mousquetaires""";201;Alexandre Dumas;;1910;;{};188;;en;
309;seFSAgAAQBAJ;https://www.googleapis.com/books/v1/volumes/seFSAgAAQBAJ;http://books.google.com/books?id=seFSAgAAQBAJ&printsec=frontcover&dq=Ernest+Hemingway&hl=&cd=37&source=gbs_api;Hemingway on War;182;Ernest Hemingway;Simon and Schuster;2014-05-22;Ernest Hemingway witnessed many of the seminal conflicts of the twentieth century—from his post as a Red Cross ambulance driver during World War I to his nearly twenty-five years as a war correspondent for The Toronto Star—and he recorded them with matchless power. This landmark volume brings together Hemingway’s most important and timeless writings about the nature of human combat. Passages from his beloved World War I novel, A Farewell to Arms, and For Whom the Bell Tolls, about the Spanish Civil War, offer an unparalleled portrayal of the physical and psychological impact of war and its aftermath. Selections from Across the River and into the Trees vividly evoke an emotionally scarred career soldier in the twilight of life as he reflects on the nature of war. Classic short stories, such as “In Another Country” and “The Butterfly and the Tank,” stand alongside excerpts from Hemingway’s first book of short stories, In Our Time, and his only full-length play, The Fifth Column. With captivating selections from Hemingway’s journalism—from his coverage of the Greco-Turkish War of 1919–22 to a legendary early interview with Mussolini to his jolting eyewitness account of the Allied invasion of Normandy on June 6, 1944—Hemingway on War collects the author’s most penetrating chronicles of perseverance and defeat, courage and fear, and love and loss in the midst of modern warfare.;{Fiction};384;;en;http://books.google.com/books/content?id=seFSAgAAQBAJ&printsec=frontcover&img=1&zoom=1&edge=curl&source=gbs_api
310;LF64DGwlMbgC;https://www.googleapis.com/books/v1/volumes/LF64DGwlMbgC;http://books.google.com/books?id=LF64DGwlMbgC&printsec=frontcover&dq=Ernest+Hemingway&hl=&cd=38&source=gbs_api;Dateline: Toronto;182;Ernest Hemingway;Simon and Schuster;2002-07-25;"Dateline: Toronto collects all 172 pieces that Hemingway published in the Star, including those under pseudonyms. Hemingway readers will discern his unique voice already present in many of these pieces, particularly his knack for dialogue. It is also fascinating to discover early reportorial accounts of events and subjects that figure in his later fiction. As William White points out in his introduction to this work, ""Much of it, over sixty years later, can still be read both as a record of the early twenties and as evidence of how Ernest Hemingway learned the craft of writing."" The enthusiasm, wit, and skill with which these pieces were written guarantee that Dateline: Toronto will be read for pleasure, as excellent journalism, and for the insights it gives to Hemingway's works.";"{""Political Science""}";653;;en;http://books.google.com/books/content?id=LF64DGwlMbgC&printsec=frontcover&img=1&zoom=1&edge=curl&source=gbs_api
311;RbkrCgAAQBAJ;https://www.googleapis.com/books/v1/volumes/RbkrCgAAQBAJ;http://books.google.com/books?id=RbkrCgAAQBAJ&printsec=frontcover&dq=Ernest+Hemingway&hl=&cd=39&source=gbs_api;Green Hills of Africa;182;Ernest Hemingway;Simon and Schuster;2015-07-21;"The most intimate and elaborately enhanced addition to the Hemingway Library series: Hemingway’s memoir of his safari across the Serengeti—presented with archival material from the Hemingway Collection at the John F. Kennedy Library, and with the never-before-published safari journal of Hemingway’s second wife, Pauline Pfeiffer. First published in 1935, Green Hills of Africa is Ernest Hemingway’s lyrical account of his safari in the great game country of East Africa with his wife Pauline. Hemingway’s fascination with big-game hunting is magnificently captured in this evocative narrative of his trip. In examining the poetic grace of the chase, and the ferocity of the kill, Hemingway looks inward, seeking to explain the lure of the hunt and the primal undercurrent that comes alive on the plains of Africa. Green Hills of Africa is also an impassioned portrait of the glory of the African landscape, and of the beauty of a wilderness that was, even then, being threatened by the incursions of man. Hemingway’s rich description of the land and his passion for hunting combine to give Green Hills of Africa the immediacy of a deeply felt individual experience that is the hallmark of the greatest travel writing. This new Hemingway Library Edition offers a fresh perspective on Hemingway’s classic travelogue with a personal foreword by Patrick Hemingway, the author’s sole surviving son, who, himself, spent many years as a professional hunter in East Africa; a new introduction by Seán Hemingway, grandson of the author; and published for the first time in its entirety the African journal of Hemingway’s wife, Pauline Pfeiffer, which provides new insight into the experiences that shaped her husband’s craft.";"{""Biography & Autobiography""}";304;3.5;en;http://books.google.com/books/content?id=RbkrCgAAQBAJ&printsec=frontcover&img=1&zoom=1&edge=curl&source=gbs_api
312;2BxdLVkXRV4C;https://www.googleapis.com/books/v1/volumes/2BxdLVkXRV4C;http://books.google.com/books?id=2BxdLVkXRV4C&printsec=frontcover&dq=Ernest+Hemingway&hl=&cd=40&source=gbs_api;The Fifth Column;182;Ernest Hemingway;Simon and Schuster;2008-06-24;Featuring Hemingway's only full-length play, The Fifth Column and Four Stories of the Spanish Civil War brilliantly evokes the tumultuous Spain of the 1930s. These works, which grew from Hemingway's adventures as a newspaper correspondent in and around besieged Madrid, movingly portray the effects of war on soldiers, civilians, and the correspondents sent to cover it.;{Drama};93;;en;http://books.google.com/books/content?id=2BxdLVkXRV4C&printsec=frontcover&img=1&zoom=1&edge=curl&source=gbs_api
313;WSKsAgAAQBAJ;https://www.googleapis.com/books/v1/volumes/WSKsAgAAQBAJ;http://books.google.com/books?id=WSKsAgAAQBAJ&printsec=frontcover&dq=Alexander+Dumas&hl=&cd=1&source=gbs_api;Alexander Dumas Dictionary Of Cuisine;195;Dumas,;Routledge;2014-01-21;First published in 2005. Routledge is an imprint of Taylor & Francis, an informa company.;"{""Social Science""}";256;;en;http://books.google.com/books/content?id=WSKsAgAAQBAJ&printsec=frontcover&img=1&zoom=1&edge=curl&source=gbs_api
314;2ef_YaKtgdAC;https://www.googleapis.com/books/v1/volumes/2ef_YaKtgdAC;http://books.google.com/books?id=2ef_YaKtgdAC&printsec=frontcover&dq=Alexander+Dumas&hl=&cd=2&source=gbs_api;The Romance of Violette;196;Attributed to Alexander Dumas Pere;Library of Alexandria;;;{};;;en;http://books.google.com/books/content?id=2ef_YaKtgdAC&printsec=frontcover&img=1&zoom=1&edge=curl&source=gbs_api
315;MHNgjgEACAAJ;https://www.googleapis.com/books/v1/volumes/MHNgjgEACAAJ;http://books.google.com/books?id=MHNgjgEACAAJ&dq=Alexander+Dumas&hl=&cd=3&source=gbs_api;Alexander Dumas Dictionary of Cuisine;197;Dumas;Routledge;2015-12-09;First published in 2005. Routledge is an imprint of Taylor & Francis, an informa company.;{};290;;en;http://books.google.com/books/content?id=MHNgjgEACAAJ&printsec=frontcover&img=1&zoom=1&source=gbs_api
316;zvyoTt6RvfgC;https://www.googleapis.com/books/v1/volumes/zvyoTt6RvfgC;http://books.google.com/books?id=zvyoTt6RvfgC&dq=Alexander+Dumas&hl=&cd=4&source=gbs_api;A companion to Alexander Dumas' Count of Monte-Cristo;198;Countess of Monte-Cristo;;1871;;{};;;en;
334;VuURAAAAYAAJ;https://www.googleapis.com/books/v1/volumes/VuURAAAAYAAJ;http://books.google.com/books?id=VuURAAAAYAAJ&pg=PA58&dq=Alexander+Dumas&hl=&cd=22&source=gbs_api;The Select Journal of Foreign Periodical Literature;207;Andrews Norton;;1834;;{};;;en;http://books.google.com/books/content?id=VuURAAAAYAAJ&printsec=frontcover&img=1&zoom=1&edge=curl&source=gbs_api
335;NFOdjgEACAAJ;https://www.googleapis.com/books/v1/volumes/NFOdjgEACAAJ;http://books.google.com/books?id=NFOdjgEACAAJ&dq=Alexander+Dumas&hl=&cd=23&source=gbs_api;"Monte-Cristo's Daughter; Sequel to Alexander Dumas' Great Novel";;;;1886;;"{""Domestic fiction""}";354;;en;
317;Mj7uoAEACAAJ;https://www.googleapis.com/books/v1/volumes/Mj7uoAEACAAJ;http://books.google.com/books?id=Mj7uoAEACAAJ&dq=Alexander+Dumas&hl=&cd=5&source=gbs_api;The Wife of Monte-Cristo. Being the Continuation of Alexander Dumas' Celebrated Novel of the Count of Monte Cristo.. - Primary Source Edition;199;Alexandre 1802-1870 Le Comte De Dumas;Nabu Press;2014-02;This is a reproduction of a book published before 1923. This book may have occasional imperfections such as missing or blurred pages, poor pictures, errant marks, etc. that were either part of the original artifact, or were introduced by the scanning process. We believe this work is culturally important, and despite the imperfections, have elected to bring it back into print as part of our continuing commitment to the preservation of printed works worldwide. We appreciate your understanding of the imperfections in the preservation process, and hope you enjoy this valuable book.;{};516;;en;http://books.google.com/books/content?id=Mj7uoAEACAAJ&printsec=frontcover&img=1&zoom=1&source=gbs_api
318;-pCYShVBQtEC;https://www.googleapis.com/books/v1/volumes/-pCYShVBQtEC;http://books.google.com/books?id=-pCYShVBQtEC&dq=Alexander+Dumas&hl=&cd=6&source=gbs_api;The Three Musketeers;200;James DeVita;Baker's Plays;2002-01-01;;{};144;;en;http://books.google.com/books/content?id=-pCYShVBQtEC&printsec=frontcover&img=1&zoom=1&source=gbs_api
319;8mBmQwAACAAJ;https://www.googleapis.com/books/v1/volumes/8mBmQwAACAAJ;http://books.google.com/books?id=8mBmQwAACAAJ&dq=Alexander+Dumas&hl=&cd=7&source=gbs_api;The Wife of Monte-Cristo Being the Continuation of Alexander Dumas' Celebrated Novel of the Count of Monte Cristo;201;Alexandre Dumas;General Books;2010-01;;{};234;;en;
320;hAB-AwAAQBAJ;https://www.googleapis.com/books/v1/volumes/hAB-AwAAQBAJ;http://books.google.com/books?id=hAB-AwAAQBAJ&dq=Alexander+Dumas&hl=&cd=8&source=gbs_api;The Three Musketeers;202;Alexander Dumas;BookRix;2015-01-26;"The Three Musketeers is a novel by Alexandre Dumas. Set in the 17th century, it recounts the adventures of a young man named d'Artagnan after he leaves home to travel to Paris, to join the Musketeers of the Guard. D'Artagnan is not one of the musketeers of the title; those are his friends Athos, Porthos and Aramis, inseparable friends who live by the motto ""all for one, one for all"", a motto which is first put forth by d'Artagnan. In 1625 France, d'Artagnan—a poor young nobleman—leaves his family in Gascony and travels to Paris with the intention of joining the Musketeers of the Guard. However, en route, at an inn in Meung-sur-Loire, an older man derides d'Artagnan's horse and, feeling insulted, d'Artagnan demands to fight a duel with him. The older man's companions beat d'Artagnan unconscious with a pot and a metal tong that breaks his sword. His letter of introduction to Monsieur de Tréville, the commander of the Musketeers, is stolen. D'Artagnan resolves to avenge himself upon the man, who is later revealed to be the Comte de Rochefort, an agent of Cardinal Richelieu, who is in Meung to pass orders from the Cardinal to Milady de Winter, another of his agents.";{Fiction};916;;en;http://books.google.com/books/content?id=hAB-AwAAQBAJ&printsec=frontcover&img=1&zoom=1&source=gbs_api
321;AoudAlXrK3kC;https://www.googleapis.com/books/v1/volumes/AoudAlXrK3kC;http://books.google.com/books?id=AoudAlXrK3kC&printsec=frontcover&dq=Alexander+Dumas&hl=&cd=9&source=gbs_api;Anthony;201;Alexandre Dumas;Wildside Press LLC;2009-01;Anthony is injured saving a beautiful girl--but can he win her love? The best-known play by French historical novelist Alexandre Dumas, translated for the first time into English.;{Drama};136;;en;http://books.google.com/books/content?id=AoudAlXrK3kC&printsec=frontcover&img=1&zoom=1&edge=curl&source=gbs_api
322;o0FiVcXD5F0C;https://www.googleapis.com/books/v1/volumes/o0FiVcXD5F0C;http://books.google.com/books?id=o0FiVcXD5F0C&dq=Alexander+Dumas&hl=&cd=10&source=gbs_api;Life and Adventures of Alexander Dumas;203;Fitzgerald Percy Hetherington;BiblioBazaar, LLC;2009-08;This is a pre-1923 historical reproduction that was curated for quality. Quality assurance was conducted on each of these books in an attempt to remove books with imperfections introduced by the digitization process. Though we have made best efforts - the books may have occasional errors that do not impede the reading experience. We believe this work is culturally important and have elected to bring the book back into print as part of our continuing commitment to the preservation of printed works worldwide.;{History};318;;en;http://books.google.com/books/content?id=o0FiVcXD5F0C&printsec=frontcover&img=1&zoom=1&source=gbs_api
323;Mzz-vQAACAAJ;https://www.googleapis.com/books/v1/volumes/Mzz-vQAACAAJ;http://books.google.com/books?id=Mzz-vQAACAAJ&dq=Alexander+Dumas&hl=&cd=11&source=gbs_api;Les Trois Mousquetaires Par Alexander Dumas;202;Alexander Dumas;Createspace Independent Publishing Platform;2016-07-18;The Three Musketeers by Alexander Dumas in the original French, with over two-hundred beautiful illustrations by Maurice Leloir, from and edition originally published in 1898. With his heart set upon becoming a Musketeer, the young d'Artagnan travels to Paris and before a single day passes he meets and is befriended by three of the most infamous of that elite company, Athos, Porthos and Aramis and he quickly becomes entangled in courtly intrigues with the sinister agents of Cardinal Richelieu, including the dastardly Comte de Rochefort and the infamous Milady de Winter. Detailing actual, historical events and based upon the memoirs of a real Captain of the Musketeers, Charles de Batz de Castlemore, also known as d'Artagnan, The Three Musketeers remains one of the most widely read and beloved books of all time.;{};570;;en;http://books.google.com/books/content?id=Mzz-vQAACAAJ&printsec=frontcover&img=1&zoom=1&source=gbs_api
324;NVRGrgEACAAJ;https://www.googleapis.com/books/v1/volumes/NVRGrgEACAAJ;http://books.google.com/books?id=NVRGrgEACAAJ&dq=Alexander+Dumas&hl=&cd=12&source=gbs_api;The Wife of Monte-Cristo. Being the Continuation of Alexander Dumas' Celebrated Novel of the Count of Monte Cristo.. - Scholar's Choice Edition;199;Alexandre 1802-1870 Le Comte De Dumas;Scholar's Choice;2015-02-15;This work has been selected by scholars as being culturally important, and is part of the knowledge base of civilization as we know it. This work was reproduced from the original artifact, and remains as true to the original work as possible. Therefore, you will see the original copyright references, library stamps (as most of these works have been housed in our most important libraries around the world), and other notations in the work. This work is in the public domain in the United States of America, and possibly other nations. Within the United States, you may freely copy and distribute this work, as no entity (individual or corporate) has a copyright on the body of the work.As a reproduction of a historical artifact, this work may contain missing or blurred pages, poor pictures, errant marks, etc. Scholars believe, and we concur, that this work is important enough to be preserved, reproduced, and made generally available to the public. We appreciate your support of the preservation process, and thank you for being an important part of keeping this knowledge alive and relevant.;{};516;;en;http://books.google.com/books/content?id=NVRGrgEACAAJ&printsec=frontcover&img=1&zoom=1&source=gbs_api
325;pj_MjwEACAAJ;https://www.googleapis.com/books/v1/volumes/pj_MjwEACAAJ;http://books.google.com/books?id=pj_MjwEACAAJ&dq=Alexander+Dumas&hl=&cd=13&source=gbs_api;Salvator;201;Alexandre Dumas;Palala Press;2015-11-19;This work has been selected by scholars as being culturally important, and is part of the knowledge base of civilization as we know it. This work was reproduced from the original artifact, and remains as true to the original work as possible. Therefore, you will see the original copyright references, library stamps (as most of these works have been housed in our most important libraries around the world), and other notations in the work.This work is in the public domain in the United States of America, and possibly other nations. Within the United States, you may freely copy and distribute this work, as no entity (individual or corporate) has a copyright on the body of the work.As a reproduction of a historical artifact, this work may contain missing or blurred pages, poor pictures, errant marks, etc. Scholars believe, and we concur, that this work is important enough to be preserved, reproduced, and made generally available to the public. We appreciate your support of the preservation process, and thank you for being an important part of keeping this knowledge alive and relevant.;{};216;;en;http://books.google.com/books/content?id=pj_MjwEACAAJ&printsec=frontcover&img=1&zoom=1&source=gbs_api
326;NoQ2AAAAMAAJ;https://www.googleapis.com/books/v1/volumes/NoQ2AAAAMAAJ;http://books.google.com/books?id=NoQ2AAAAMAAJ&printsec=frontcover&dq=Alexander+Dumas&hl=&cd=14&source=gbs_api;Garibaldi: an Autobiography;204;Giuseppe Garibaldi;;1861;;{};337;;en;http://books.google.com/books/content?id=NoQ2AAAAMAAJ&printsec=frontcover&img=1&zoom=1&edge=curl&source=gbs_api
327;VtWcDAEACAAJ;https://www.googleapis.com/books/v1/volumes/VtWcDAEACAAJ;http://books.google.com/books?id=VtWcDAEACAAJ&dq=Alexander+Dumas&hl=&cd=15&source=gbs_api;Edmond Dantes;201;Alexandre Dumas;;19??;;{France};378;;en;
328;3d5GAQAAMAAJ;https://www.googleapis.com/books/v1/volumes/3d5GAQAAMAAJ;http://books.google.com/books?id=3d5GAQAAMAAJ&pg=PA163&dq=Alexander+Dumas&hl=&cd=16&source=gbs_api;Alexander Dumas gesammelte Erzählungen;201;Alexandre Dumas;;1835;;{};;;de;http://books.google.com/books/content?id=3d5GAQAAMAAJ&printsec=frontcover&img=1&zoom=1&edge=curl&source=gbs_api
