id;google_id;json_volume;previewlink;title;author_id;author_name;publisher;publisherdate;description;categories;pages;rating;language;image
162;CcRjfhfGmOsC;https://www.googleapis.com/books/v1/volumes/CcRjfhfGmOsC;http://books.google.com/books?id=CcRjfhfGmOsC&printsec=frontcover&dq=William+shakespeare&hl=&cd=8&source=gbs_api;William Shakespeare;120;David Hilliam;The Rosen Publishing Group;2005;Describes the life and accomplishments of one of the most famous and prolific playwrights of all time, William Shakespeare, who wrote on average of two plays every year for twenty years.;"{""Juvenile Nonfiction""}";112;;en;http://books.google.com/books/content?id=CcRjfhfGmOsC&printsec=frontcover&img=1&zoom=1&edge=curl&source=gbs_api
165;S6U6qp4xJMQC;https://www.googleapis.com/books/v1/volumes/S6U6qp4xJMQC;http://books.google.com/books?id=S6U6qp4xJMQC&printsec=frontcover&dq=William+shakespeare&hl=&cd=11&source=gbs_api;The Sonnets;116;William Shakespeare;Cambridge University Press;1996-04-18;"This new edition focuses on the Sonnets as poetry--often subtly interlinked in thematic, imagistic and other groupings. The volume also addresses the many questions that have puzzled readers: are the Sonnets autobiographical? What is the nature of the ""love"" between the ""poet,"" the ""youth"" and the ""Dark Lady?"" Can they be identified? When were the Sonnets written and in what order? The volume is introduced by the poet and scholar, Anthony Hecht. The text has been edited and extensively annotated by Gwynne Blakemore Evans. The volume as a whole will appeal to a new generation of students and poetry lovers.";{Drama};297;4;en;http://books.google.com/books/content?id=S6U6qp4xJMQC&printsec=frontcover&img=1&zoom=1&edge=curl&source=gbs_api
166;eMBwueQHR_UC;https://www.googleapis.com/books/v1/volumes/eMBwueQHR_UC;http://books.google.com/books?id=eMBwueQHR_UC&printsec=frontcover&dq=William+shakespeare&hl=&cd=12&source=gbs_api;Shakespeare's Sonnets;116;William Shakespeare;Cengage Learning EMEA;1997-08-21;The classic love poems of William Shakespeare are accompanied by commentary and critical notes.;{Drama};488;4;en;http://books.google.com/books/content?id=eMBwueQHR_UC&printsec=frontcover&img=1&zoom=1&edge=curl&source=gbs_api
167;YBTfWmq812oC;https://www.googleapis.com/books/v1/volumes/YBTfWmq812oC;http://books.google.com/books?id=YBTfWmq812oC&printsec=frontcover&dq=William+shakespeare&hl=&cd=13&source=gbs_api;Hamlet for Kids;122;Lois Burdett;Firefly Books;2000;Retells in rhymed couplets Shakespeare's tragedy about the Danish prince's efforts to avenge his father's death, with illustrations by second graders.;"{""Juvenile Nonfiction""}";64;5;en;http://books.google.com/books/content?id=YBTfWmq812oC&printsec=frontcover&img=1&zoom=1&edge=curl&source=gbs_api
168;oJAth9g0xbMC;https://www.googleapis.com/books/v1/volumes/oJAth9g0xbMC;http://books.google.com/books?id=oJAth9g0xbMC&printsec=frontcover&dq=William+shakespeare&hl=&cd=14&source=gbs_api;William Shakespeare's Hamlet;123;Michael Feingold;Barron's Educational Series;1984;"A guide to reading ""Hamlet"" with a critical and appreciative mind. Includes background on the author's life and times, sample tests, term paper suggestions, and a reading list.";"{""Literary Criticism""}";131;;en;http://books.google.com/books/content?id=oJAth9g0xbMC&printsec=frontcover&img=1&zoom=1&edge=curl&source=gbs_api
169;yMpXWoN8Pg0C;https://www.googleapis.com/books/v1/volumes/yMpXWoN8Pg0C;http://books.google.com/books?id=yMpXWoN8Pg0C&printsec=frontcover&dq=William+shakespeare&hl=&cd=15&source=gbs_api;Manhood and Masculine Identity in William Shakespeare's The Tragedy of Macbeth;124;Maria L. Howell;University Press of America;2008;"""Maria Howell's Manhood and Masculine Identity in William Shakespeare's ""The Tragedy of Macbeth"" is an important and compelling scholarly work which seeks to examine the sixteenth century's greatest concern, echoed by Hamlet himself, ""What is a man?"" In an attempt to analyze the concept of manhood in Macbeth, Howell explores the contradictions and ambiguities that underlie heroic notions of masculinity dramatized throughout the play. From Lady Macbeth's capacity to control and destroy Macbeth's masculine identity, to Macbeth himself, who corrupts his military prowess to become a ruthless and murderous tyrant, Howell demonstrates that heroic notions of masculinity not only reinforce masculine power and authority, paradoxically, these ideals are also the source of man's disempowerment and destruction. Howell argues that in an attempt to attain a higher principle, the means (violence and destruction) and the ends (justice and peace) become fused and indistinguishable, so that those values that inform man's actions for good no longer provide moral clarity. Howell's poignant and timely analysis of manhood and masculine identity in Shakespeare's Macbeth will no doubt resonate with readers today.""--BOOK JACKET.";{Drama};49;;en;http://books.google.com/books/content?id=yMpXWoN8Pg0C&printsec=frontcover&img=1&zoom=1&edge=curl&source=gbs_api
170;at2X4wJ3tUcC;https://www.googleapis.com/books/v1/volumes/at2X4wJ3tUcC;http://books.google.com/books?id=at2X4wJ3tUcC&printsec=frontcover&dq=William+shakespeare&hl=&cd=16&source=gbs_api;The Routledge Guide to William Shakespeare;125;Robert Shaughnessy;Routledge;2011;Demystifying and contextualising Shakespeare for the twenty-first century, this book offers both an introduction to the subject for beginners as well as an invaluable resource for more experienced Shakespeareans. In this friendly, structured guide, Robert Shaughnessy: introduces Shakespeare's life and works in context, providing crucial historical background looks at each of Shakespeare's plays in turn, considering issues of historical context, contemporary criticism and performance history provides detailed discussion of twentieth-century Shakespearean criticism, exploring the theories, debates and discoveries that shape our understanding of Shakespeare today looks at contemporary performances of Shakespeare on stage and screen provides further critical reading by play outlines detailed chronologies of Shakespeare's life and works and also of twentieth-century criticism The companion website at www.routledge.com/textbooks/shaughnessy contains student-focused materials and resources, including an interactive timeline and annotated weblinks.;"{""Literary Criticism""}";486;;en;http://books.google.com/books/content?id=at2X4wJ3tUcC&printsec=frontcover&img=1&zoom=1&edge=curl&source=gbs_api
171;PjAh3QJBTxoC;https://www.googleapis.com/books/v1/volumes/PjAh3QJBTxoC;http://books.google.com/books?id=PjAh3QJBTxoC&printsec=frontcover&dq=William+shakespeare&hl=&cd=17&source=gbs_api;The Tempest;116;William Shakespeare;;1864;;{};72;4.5;en;http://books.google.com/books/content?id=PjAh3QJBTxoC&printsec=frontcover&img=1&zoom=1&edge=curl&source=gbs_api
172;J-osAAAAQAAJ;https://www.googleapis.com/books/v1/volumes/J-osAAAAQAAJ;http://books.google.com/books?id=J-osAAAAQAAJ&printsec=frontcover&dq=William+shakespeare&hl=&cd=18&source=gbs_api;Tales from Shakespeare;126;Charles Lamb;;1863;;{};336;1;en;http://books.google.com/books/content?id=J-osAAAAQAAJ&printsec=frontcover&img=1&zoom=1&edge=curl&source=gbs_api
173;RfoNAQAAMAAJ;https://www.googleapis.com/books/v1/volumes/RfoNAQAAMAAJ;http://books.google.com/books?id=RfoNAQAAMAAJ&q=William+shakespeare&dq=William+shakespeare&hl=&cd=19&source=gbs_api;William Shakespeare;127;Richard Hillman;Twayne Pub;1993;"Are they comedies, romances, tragedies, or satires? Shakespeare's Troilus and Cressida, All's Well that Ends Well, and Measure for Measure so clearly resist conventional genre classification and reductive critical schemes that they have come to be known as his ""problem plays."" In one of the few books in recent years to take on these notoriously slippery texts as a group, Richard Hillman elegantly turns that artificial categorization to critical advantage, showing us that this radical instability of genre is not an obstacle but an invitation to understanding, and that it frames human existence itself as a tableau of shape-changing uncertainties. In these three works, Hillman explains, the dramatist played with, not according to, the rules of genre; each is an exquisitely volatile fusion of traditional romance material and realistic style, comic resolutions and tragic tendencies. In close, detailed readings of the plays, Hillman shows us how each creates a turbulent world of circulating desire, misplaced blame, moral instability, and pervasive self-deception. With his guidance we see, as Shakespeare's confused characters do not, that even romantic love, for instance, ""is less a subject for serious scrutiny than a red herring,"" and that the real issue is often the wielding of personal and political power. From Hillman's insights arise fascinating new perspectives on such traditional ""problems"" as the culpability of Cressida, Bertram's dubious qualifications as a romantic lead, the dilemma of Isabella, and the moral authority of Vincentio. Informing this exciting analysis at every stage are Hillman's learned discussions of Shakespeare's cultural milieu: the rise of ""citizen comedy,"" the fashion for satire, the stereotype of the malcontent, and the typical Jacobean mixture of cynicism and idealism. The postmodern concept of intertextuality plays a prominent role in the discussion, as does an innovative application of the principle of metadrama. Hillman develops - and combines - these approaches with originality, wit, and intellectual dexterity. In essence, this is a study that reanimates the ""problem plays"" as precisely that, thereby earning the status of a true landmark in Shakespeare criticism.";{Drama};185;;en;http://books.google.com/books/content?id=RfoNAQAAMAAJ&printsec=frontcover&img=1&zoom=1&source=gbs_api
201;FckfgNqvweEC;https://www.googleapis.com/books/v1/volumes/FckfgNqvweEC;http://books.google.com/books?id=FckfgNqvweEC&printsec=frontcover&dq=George+Orwell&hl=&cd=7&source=gbs_api;George Orwell's 1984;138;Kit Reed;Barron's Educational Series;1984-01;"A guide to reading ""1984"" with a critical and appreciative mind. Includes background on the author's life and times, sample tests, term paper suggestions, and a reading list.";"{""Study Aids""}";118;;en;http://books.google.com/books/content?id=FckfgNqvweEC&printsec=frontcover&img=1&zoom=1&edge=curl&source=gbs_api
174;7i_bVhxkocEC;https://www.googleapis.com/books/v1/volumes/7i_bVhxkocEC;http://books.google.com/books?id=7i_bVhxkocEC&printsec=frontcover&dq=William+shakespeare&hl=&cd=20&source=gbs_api;The Winter's Tale;116;William Shakespeare;Classic Books Company;2001-04;The Winter's Tale is regarded as Shakespeare's most perfectly realized tragicomedy. Though the title may suggest an escapist fantasy, recent criticism has seen in the play a realistic psychology and a powerful commentary on the violence implicit in family relationships and deep, longlasting friendships. This edition considers the play in relation to Renaissance conceptions of both dramatic genre and the family, traces the changing critical and theatrical attitudes towards it and places its psychological and dramatic conflicts within the Jacobean cultural and political context. The commentary pays special attention to the play's linguistic complexity and also includes a complete reprint of Shakespeare's source, Pandosto, by Robert Greene.;{};500;3;en;http://books.google.com/books/content?id=7i_bVhxkocEC&printsec=frontcover&img=1&zoom=1&edge=curl&source=gbs_api
175;n_z06OOUlosC;https://www.googleapis.com/books/v1/volumes/n_z06OOUlosC;http://books.google.com/books?id=n_z06OOUlosC&printsec=frontcover&dq=William+shakespeare&hl=&cd=21&source=gbs_api;William Shakespeare's Macbeth;128;Alexander Leggatt;Taylor & Francis;2006;William Shakespeare’s Macbeth is a timeless tale of love, greed and power, which has given rise to heated debates around such issues as the representation of gender roles, political violence and the dramatisation of evil. Taking the form of a sourcebook, this guide to Shakespeare’s play presents: extensive introductory comment on the contexts, critical history and performance of the text, from publication to present annotated extracts from key contextual documents, reviews, critical works and the text itself cross-references between documents and sections of the guide, in order to suggest links between texts, contexts and criticism suggestions for further reading. Part of the Routledge Guides to Literature series, this volume is essential reading for all those beginning detailed study of Macbeth and seeking not only a guide to the play, but a way through the wealth of contextual and critical material that surrounds Shakespeare’s text.;"{""Literary Criticism""}";197;;en;http://books.google.com/books/content?id=n_z06OOUlosC&printsec=frontcover&img=1&zoom=1&edge=curl&source=gbs_api
176;Jmy0ZWUA2ScC;https://www.googleapis.com/books/v1/volumes/Jmy0ZWUA2ScC;http://books.google.com/books?id=Jmy0ZWUA2ScC&printsec=frontcover&dq=William+shakespeare&hl=&cd=22&source=gbs_api;William Shakespeare: The Complete Works;116;William Shakespeare;OUP Oxford;2005-04-21;The second Oxford edition of Shakespeare's Complete Works reconsiders every detail of their text and presentation in the light of modern scholarship. The nature and authority of the early documents are re-examined, and the canon and chronological order of composition freshly established. Spelling and punctuation are modernized, and there is a brief introduction to each work, as well as an illuminating and informative General Introduction. Included here for the first time is the play The Reign of King Edward the Third as well as the full text of Sir Thomas More. This new edition also features an essay on Shakespeare's language by David Crystal, and a bibliography of foundational works.;"{""Literary Collections""}";1424;5;en;http://books.google.com/books/content?id=Jmy0ZWUA2ScC&printsec=frontcover&img=1&zoom=1&edge=curl&source=gbs_api
177;-wEuAAAAYAAJ;https://www.googleapis.com/books/v1/volumes/-wEuAAAAYAAJ;http://books.google.com/books?id=-wEuAAAAYAAJ&printsec=frontcover&dq=William+shakespeare&hl=&cd=23&source=gbs_api;A New Variorum Edition of Shakespeare: Romeo and Juliet. 1871;116;William Shakespeare;;1871;;{};;;en;http://books.google.com/books/content?id=-wEuAAAAYAAJ&printsec=frontcover&img=1&zoom=1&edge=curl&source=gbs_api
178;mYeFaO3Z92kC;https://www.googleapis.com/books/v1/volumes/mYeFaO3Z92kC;http://books.google.com/books?id=mYeFaO3Z92kC&printsec=frontcover&dq=William+shakespeare&hl=&cd=24&source=gbs_api;Othello;116;William Shakespeare;Barron's Educational Series;2002;"Shakespeare's tragedy of the Moor whose love for Desdemona is destroyed by jealousy is presented in its original text on each left-hand page, with a modernized ""translation"" on the facing right-hand page. Also included are quizzes and discussion points that teachers can use in the classroom and include in tests.";{Drama};319;;en;http://books.google.com/books/content?id=mYeFaO3Z92kC&printsec=frontcover&img=1&zoom=1&edge=curl&source=gbs_api
179;Yn8LAAAAIAAJ;https://www.googleapis.com/books/v1/volumes/Yn8LAAAAIAAJ;http://books.google.com/books?id=Yn8LAAAAIAAJ&printsec=frontcover&dq=William+shakespeare&hl=&cd=25&source=gbs_api;The Dramatic Works of William Shakespeare;116;William Shakespeare;;1813;;{};;;en;http://books.google.com/books/content?id=Yn8LAAAAIAAJ&printsec=frontcover&img=1&zoom=1&edge=curl&source=gbs_api
180;7vIjAAAAMAAJ;https://www.googleapis.com/books/v1/volumes/7vIjAAAAMAAJ;http://books.google.com/books?id=7vIjAAAAMAAJ&pg=PA149&dq=William+shakespeare&hl=&cd=26&source=gbs_api;The Plays of William Shakespeare;116;William Shakespeare;;1809;;{};;;en;http://books.google.com/books/content?id=7vIjAAAAMAAJ&printsec=frontcover&img=1&zoom=1&edge=curl&source=gbs_api
181;tQhsjhxiVx4C;https://www.googleapis.com/books/v1/volumes/tQhsjhxiVx4C;http://books.google.com/books?id=tQhsjhxiVx4C&printsec=frontcover&dq=William+shakespeare&hl=&cd=27&source=gbs_api;William Shakespeare;129;Carol Dommermuth-Costa;Twenty-First Century Books;2001-10-01;Examines the life of William Shakespeare, focusing on the meaning behind some of his most famous works of literature.;"{""Juvenile Nonfiction""}";112;;en;http://books.google.com/books/content?id=tQhsjhxiVx4C&printsec=frontcover&img=1&zoom=1&edge=curl&source=gbs_api
182;MVk917PGJboC;https://www.googleapis.com/books/v1/volumes/MVk917PGJboC;http://books.google.com/books?id=MVk917PGJboC&printsec=frontcover&dq=William+shakespeare&hl=&cd=28&source=gbs_api;Romeo and Juliet;130;Aidan Coleman;Insight Publications;2008;"""An abridged version of William Shakespeare's play, Romeo & Juliet, with discussion questions, history and language points as teaching guide.""--Provided by publisher.";{};170;4;en;http://books.google.com/books/content?id=MVk917PGJboC&printsec=frontcover&img=1&zoom=1&edge=curl&source=gbs_api
202;jzEncIezSwkC;https://www.googleapis.com/books/v1/volumes/jzEncIezSwkC;http://books.google.com/books?id=jzEncIezSwkC&pg=PA21&dq=George+Orwell&hl=&cd=8&source=gbs_api;George Orwell's 1984;132;Harold Bloom;Infobase Publishing;2009-01-01;Examines different aspects of Orwell's anti-utopian classic, with a biographical sketch of the author and critical essays on this work.;"{""Dystopias in literature""}";124;;en;http://books.google.com/books/content?id=jzEncIezSwkC&printsec=frontcover&img=1&zoom=1&edge=curl&source=gbs_api
204;zaxG_3ivhVAC;https://www.googleapis.com/books/v1/volumes/zaxG_3ivhVAC;http://books.google.com/books?id=zaxG_3ivhVAC&dq=George+Orwell&hl=&cd=10&source=gbs_api;George Orwell: In front of your nose, 1946-1950;136;George Orwell;David R. Godine Publisher;2000-01-01;;"{""Literary Collections""}";555;4.5;en;http://books.google.com/books/content?id=zaxG_3ivhVAC&printsec=frontcover&img=1&zoom=1&source=gbs_api
183;Mh50NAN6YdUC;https://www.googleapis.com/books/v1/volumes/Mh50NAN6YdUC;http://books.google.com/books?id=Mh50NAN6YdUC&dq=William+shakespeare&hl=&cd=29&source=gbs_api;William Shakespeare;131;Terry Eagleton;Wiley-Blackwell;1991-01-08;"This is a bold and original reinterpretation of almost all of Shakespeare's major plays, in the light of the Marxist, feminist and semiotic ideas of our own time. Through a set of tenaciously detailed readings, the book illuminates a number of persistent problems or conflicts in Shakespearean drama - in particular a contradiction between words and things, body and language, which is also explored in terms of law, sexuality and Nature. Language and desire, Terry Eagleton argues, are seen by Shakespeare as a kind of 'surplus' over and above the body, stable and social roles and a fixed human nature. But the attitude of the plays to such a 'surplus' is profoundly ambivalent; if they admire it as the very source of human creativity, they also fear its anarchic, trangressive force. Underlying such ambiguities, the book convincingly shows, is a deeper ideological struggle, between feudalist traditionalism on the one hand, and the emergence of new forms of bourgeois individualism on the other. This book revels how, in the light of our own contemporary theories of language, sexuality and society, we can understand the issues present in Shakespeare's drama which previously have remained obscure.";"{""Literary Criticism""}";128;;en;http://books.google.com/books/content?id=Mh50NAN6YdUC&printsec=frontcover&img=1&zoom=1&source=gbs_api
184;dvn3uent7VcC;https://www.googleapis.com/books/v1/volumes/dvn3uent7VcC;http://books.google.com/books?id=dvn3uent7VcC&printsec=frontcover&dq=William+shakespeare&hl=&cd=30&source=gbs_api;Macbeth;116;William Shakespeare;Cambridge University Press;1997-07-24;Shakespeare's drama of murder, political ambition, and the persistence of guilt is accompanied by information about the play's background, style, and performance;{Drama};280;4.5;en;http://books.google.com/books/content?id=dvn3uent7VcC&printsec=frontcover&img=1&zoom=1&edge=curl&source=gbs_api
185;Nj329R-gWHkC;https://www.googleapis.com/books/v1/volumes/Nj329R-gWHkC;http://books.google.com/books?id=Nj329R-gWHkC&printsec=frontcover&dq=William+shakespeare&hl=&cd=31&source=gbs_api;Henry VIII;116;William Shakespeare;Filiquarian Publishing, LLC.;2007-09;Henry VIII is a History written by English playwright William Shakespeare, who is widely considered to be the greatest writer of the English language. Henry VIII is a play about the turbulent reign og Henry VIII including his separation from his wife, infatuation with Anna Boleyn and also the rise of Cardinal Woolsey. Henry VIII is an important work of William Shakespeares, and is highly recommended for fans of his works as well as those discovering his plays for the first time.;{Drama};184;;en;http://books.google.com/books/content?id=Nj329R-gWHkC&printsec=frontcover&img=1&zoom=1&edge=curl&source=gbs_api
186;VhWsLqwGjdsC;https://www.googleapis.com/books/v1/volumes/VhWsLqwGjdsC;http://books.google.com/books?id=VhWsLqwGjdsC&printsec=frontcover&dq=William+shakespeare&hl=&cd=32&source=gbs_api;Measure for Measure;116;William Shakespeare;Heinemann;2000-01;"""The version of Measure For Measure and the corresponding footnotes that appear in this volume were originally published in William Shakespeare: Complete Works, edited by Jonathan Bate and Eric Rasmussen, published in 2007 by Modern Library""--T.p. verso.";"{""English drama""}";274;;en;http://books.google.com/books/content?id=VhWsLqwGjdsC&printsec=frontcover&img=1&zoom=1&edge=curl&source=gbs_api
187;1IRTSFdviK4C;https://www.googleapis.com/books/v1/volumes/1IRTSFdviK4C;http://books.google.com/books?id=1IRTSFdviK4C&printsec=frontcover&dq=William+shakespeare&hl=&cd=33&source=gbs_api;King Lear;116;William Shakespeare;Yale University Press;2007;King Lear, one of Shakespeare's darkest and most savage plays, tells the story of the foolish and Job-like Lear, who divides his kingdom, as he does his affections, according to vanity and whim. Lear’s failure as a father engulfs himself and his world in turmoil and tragedy.;{Drama};215;5;en;http://books.google.com/books/content?id=1IRTSFdviK4C&printsec=frontcover&img=1&zoom=1&edge=curl&source=gbs_api
188;IkVxi54TQ58C;https://www.googleapis.com/books/v1/volumes/IkVxi54TQ58C;http://books.google.com/books?id=IkVxi54TQ58C&printsec=frontcover&dq=William+shakespeare&hl=&cd=34&source=gbs_api;Romeo and Juliet;116;William Shakespeare;Barron's Educational Series;2008-09-01;Presents the original text of Shakespeare's play side by side with a modern version, with discussion questions, role-playing scenarios, and other study activities.;{Drama};302;4;en;http://books.google.com/books/content?id=IkVxi54TQ58C&printsec=frontcover&img=1&zoom=1&edge=curl&source=gbs_api
189;hvsnAAAAYAAJ;https://www.googleapis.com/books/v1/volumes/hvsnAAAAYAAJ;http://books.google.com/books?id=hvsnAAAAYAAJ&printsec=frontcover&dq=William+shakespeare&hl=&cd=35&source=gbs_api;King Henry V.;116;William Shakespeare;;1868;;{};93;;en;http://books.google.com/books/content?id=hvsnAAAAYAAJ&printsec=frontcover&img=1&zoom=1&edge=curl&source=gbs_api
190;31-VznNmDQAC;https://www.googleapis.com/books/v1/volumes/31-VznNmDQAC;http://books.google.com/books?id=31-VznNmDQAC&printsec=frontcover&dq=William+shakespeare&hl=&cd=36&source=gbs_api;As You Like It;116;William Shakespeare;Simon and Schuster;2011-08-23;Readers and audiences have long greeted As You Like It with delight. Its characters are brilliant conversationalists, including the princesses Rosalind and Celia and their Fool, Touchstone. Soon after Rosalind and Orlando meet and fall in love, the princesses and Touchstone go into exile in the Forest of Arden, where they find new conversational partners. Duke Frederick, younger brother to Duke Senior, has overthrown his brother and forced him to live homeless in the forest with his courtiers, including the cynical Jaques. Orlando, whose older brother Oliver plotted his death, has fled there, too. Recent scholars have also grounded the play in the issues of its time. These include primogeniture, passing property from a father to his oldest son. As You Like It depicts intense conflict between brothers, exposing the human suffering that primogeniture entails. Another perspective concerns crossdressing. Most of Orlando’s courtship of Rosalind takes place while Rosalind is disguised as a man, “Ganymede.” At her urging, Orlando pretends that Ganymede is his beloved Rosalind. But as the epilogue reveals, the sixteenth-century actor playing Rosalind was male, following the practice of the time. In other words, a boy played a girl playing a boy pretending to be a girl. The authoritative edition of As You Like It from The Folger Shakespeare Library, the trusted and widely used Shakespeare series for students and general readers, is now available as an eBook. Features include: · The exact text of the printed book for easy cross-reference · Hundreds of hypertext links for instant navigation · Freshly edited text based on the best early printed version of the play · Full explanatory notes conveniently placed on pages facing the text of the play · Scene-by-scene plot summaries · A key to famous lines and phrases · An introduction to reading Shakespeare’s language · Illustrations from the Folger Shakespeare Library’s vast holdings of rare books · An essay by a leading Shakespeare scholar providing a modern perspective on the play;{Drama};320;5;en;http://books.google.com/books/content?id=31-VznNmDQAC&printsec=frontcover&img=1&zoom=1&edge=curl&source=gbs_api
