id;google_id;json_volume;previewlink;title;author_id;author_name;publisher;publisherdate;description;categories;pages;rating;language;image
499;Nw3slzDTKYcC;https://www.googleapis.com/books/v1/volumes/Nw3slzDTKYcC;http://books.google.com/books?id=Nw3slzDTKYcC&pg=PA286&dq=George+Eliot&hl=&cd=27&source=gbs_api;George Eliot's 'Daniel Deronda' Notebooks;265;George Eliot;Cambridge University Press;1996-11-21;"George Eliot's notebooks from the years 1872–77 contain memoranda of her reading while she was preparing for and writing Daniel Deronda, together with the 'Oriental Memoranda' and other notes she recorded in the year following the novel's publication. Above all, the notebooks reveal her acquisition of a wide range of learning about Judaism and provide insight into the creative process of integrating that learning into Daniel Deronda. One of these notebooks is published in this 1996 book; others are offered in new transcriptions. They are all presented in a form which demonstrates the intellectual coherence underlying the diversity of the memoranda: translations are provided for the notes in German, French, Italian, Greek, and Hebrew; explanatory notes are offered, and interpretative links are made to the novel; primary sources are traced and the chronology of Eliot's reading outlined.";"{""Literary Criticism""}";524;;en;http://books.google.com/books/content?id=Nw3slzDTKYcC&printsec=frontcover&img=1&zoom=1&edge=curl&source=gbs_api
500;zeE6AAAAIAAJ;https://www.googleapis.com/books/v1/volumes/zeE6AAAAIAAJ;http://books.google.com/books?id=zeE6AAAAIAAJ&pg=PR12&dq=George+Eliot&hl=&cd=28&source=gbs_api;George Eliot and Nineteenth-Century Science;281;Sally Shuttleworth;CUP Archive;1984-03-29;This study explores the ways in which George Eliot's involvement with contemporary scientific theory affected the evolution of her fiction. Drawing on the work of such theorists as Comte, Spencer, Lewes, Bain, Carpenter, von Hartmann and Bernard, Dr Shuttleworth shows how, as Eliot moved from Adam Bede to Daniel Deronda, her conception of a conservative, static and hierarchical model of society gave way to a more dynamic model of social and psychological life.;"{""Literary Criticism""}";257;;en;http://books.google.com/books/content?id=zeE6AAAAIAAJ&printsec=frontcover&img=1&zoom=1&edge=curl&source=gbs_api
501;-k84AAAAIAAJ;https://www.googleapis.com/books/v1/volumes/-k84AAAAIAAJ;http://books.google.com/books?id=-k84AAAAIAAJ&pg=PA152&dq=George+Eliot&hl=&cd=29&source=gbs_api;George Eliot: her mind and her art...;;;CUP Archive;;;{};;;en;http://books.google.com/books/content?id=-k84AAAAIAAJ&printsec=frontcover&img=1&zoom=1&edge=curl&source=gbs_api
502;-LCJDSashDsC;https://www.googleapis.com/books/v1/volumes/-LCJDSashDsC;http://books.google.com/books?id=-LCJDSashDsC&pg=PA391&dq=George+Eliot&hl=&cd=30&source=gbs_api;George Eliot;283;George Willis Cooke;Cambridge University Press;2010-09-16;Cooke's Study seeks to prioritise the interpretation and criticism of Eliot's works, and offers a thorough examination of Eliot's writing.;"{""Literary Criticism""}";450;;en;http://books.google.com/books/content?id=-LCJDSashDsC&printsec=frontcover&img=1&zoom=1&edge=curl&source=gbs_api
503;-QyiIVW9K5AC;https://www.googleapis.com/books/v1/volumes/-QyiIVW9K5AC;http://books.google.com/books?id=-QyiIVW9K5AC&pg=PA27&dq=George+Eliot&hl=&cd=31&source=gbs_api;Silas Marner - George Eliot;132;Harold Bloom;Infobase Publishing;2009-01-01;Considered by some as enchanting as a fairy tale and in some ways as simple in its approach, George Eliot's Silas Marner extends well beyond such a sphere. The text focuses on the evils of religion and society, both of which ostracize those they do not understand. Study the novel through the work of some of the most respected critics on the subject. The title, George EliotOCOs Silas Marner, part of Chelsea House PublishersOCO Modern Critical Interpretations series, presents the most important 20th-century criticism on George EliotOCOs Silas Marner through extracts of critical essays by well-known literary critics. This collection of criticism also features a short biography on George Eliot, a chronology of the authorOCOs life, and an introductory essay written by Harold Bloom, Sterling Professor of the Humanities, Yale University.;"{""Fathers and daughters in literature""}";206;;en;http://books.google.com/books/content?id=-QyiIVW9K5AC&printsec=frontcover&img=1&zoom=1&edge=curl&source=gbs_api
504;W4MM3pxhA-UC;https://www.googleapis.com/books/v1/volumes/W4MM3pxhA-UC;http://books.google.com/books?id=W4MM3pxhA-UC&pg=PA53&dq=George+Eliot&hl=&cd=33&source=gbs_api;George Eliot's Novels;284;Shalini Sharma;Sarup & Sons;2003-01-01;Study on the works of George Eliot, 1819-1880, English novelist.;{};139;;en;http://books.google.com/books/content?id=W4MM3pxhA-UC&printsec=frontcover&img=1&zoom=1&edge=curl&source=gbs_api
505;c9rgKc8Hp1gC;https://www.googleapis.com/books/v1/volumes/c9rgKc8Hp1gC;http://books.google.com/books?id=c9rgKc8Hp1gC&pg=PR14&dq=George+Eliot&hl=&cd=34&source=gbs_api;Everyone and Everything in George Eliot;;;M.E. Sharpe;;;{};;;en;http://books.google.com/books/content?id=c9rgKc8Hp1gC&printsec=frontcover&img=1&zoom=1&edge=curl&source=gbs_api
506;AzLZAAAAIAAJ;https://www.googleapis.com/books/v1/volumes/AzLZAAAAIAAJ;http://books.google.com/books?id=AzLZAAAAIAAJ&pg=PA1&dq=George+Eliot&hl=&cd=35&source=gbs_api;The Early Life of George Eliot;;;Manchester University Press;1976;;{};188;;en;http://books.google.com/books/content?id=AzLZAAAAIAAJ&printsec=frontcover&img=1&zoom=1&edge=curl&source=gbs_api
507;EhKVTx-RUA4C;https://www.googleapis.com/books/v1/volumes/EhKVTx-RUA4C;http://books.google.com/books?id=EhKVTx-RUA4C&pg=PA64&dq=George+Eliot&hl=&cd=36&source=gbs_api;George Eliot's Early Novels;287;U. C. Knoepflmacher;Univ of California Press;1968;;"{""Didactic fiction"",English}";269;;en;http://books.google.com/books/content?id=EhKVTx-RUA4C&printsec=frontcover&img=1&zoom=1&edge=curl&source=gbs_api
510;ohHkyE8R2CAC;https://www.googleapis.com/books/v1/volumes/ohHkyE8R2CAC;http://books.google.com/books?id=ohHkyE8R2CAC&pg=PA24&dq=George+Eliot&hl=&cd=39&source=gbs_api;George Eliot's Intellectual Life;288;Avrom Fleishman;Cambridge University Press;2010-02-18;It is well known that George Eliot's intelligence and her wide knowledge of literature, history, philosophy and religion shaped her fiction, but until now no study has followed the development of her thinking through her whole career. This intellectual biography traces the course of that development from her initial Christian culture, through her loss of faith and working out of a humanistic and cautiously progressive world view, to the thought-provoking achievements of her novels. It focuses on her responses to her reading in her essays, reviews and letters as well as in the historical pictures of Romola, the political implications of Felix Holt, the comprehensive view of English society in Middlemarch, and the visionary account of personal inspiration in Daniel Deronda. This portrait of a major Victorian intellectual is an important addition to our understanding of Eliot's mind and works, as well as of her place in nineteenth-century British culture.;"{""Literary Criticism""}";;;en;http://books.google.com/books/content?id=ohHkyE8R2CAC&printsec=frontcover&img=1&zoom=1&edge=curl&source=gbs_api
511;9cJkAwAAQBAJ;https://www.googleapis.com/books/v1/volumes/9cJkAwAAQBAJ;http://books.google.com/books?id=9cJkAwAAQBAJ&printsec=frontcover&dq=George+Eliot&hl=&cd=40&source=gbs_api;Darwin's Plots;289;Gillian Beer;Cambridge University Press;2009-05-28;Gillian Beer's classic Darwin's Plots, one of the most influential works of literary criticism and cultural history of the last quarter century, is here reissued in an updated edition to coincide with the anniversary of Darwin's birth and of the publication of The Origin of Species. Its focus on how writers, including George Eliot, Charles Kingsley and Thomas Hardy, responded to Darwin's discoveries and to his innovations in scientific language continues to open up new approaches to Darwin's thought and to its effects in the culture of his contemporaries. This third edition includes an important new essay that investigates Darwin's concern with consciousness across all forms of organic life. It demonstrates how this fascination persisted throughout his career and affected his methods and discoveries. With an updated bibliography reflecting recent work in the field, this book will retain its place at the heart of Victorian studies.;"{""Literary Criticism""}";;;en;http://books.google.com/books/content?id=9cJkAwAAQBAJ&printsec=frontcover&img=1&zoom=1&edge=curl&source=gbs_api
512;pAKcAwAAQBAJ;https://www.googleapis.com/books/v1/volumes/pAKcAwAAQBAJ;http://books.google.com/books?id=pAKcAwAAQBAJ&dq=Sunil+Gavaskar&hl=&cd=1&source=gbs_api;The Sunil Gavaskar Omnibus;290;Sunil Gavaskar;Rupa Publications;2012-12-26;This Omnibus brings together three of his most riveting books. Sunny Days is indeed a classic, tracing his cricketing career from his childhood. In Idols, he pays tribute to thirty-one of his contemporaries from the cricketing world. One Day Wonders is a superb collection of the most memorable one day matches played by India. The Sunil Gavaskar Omnibus is a perfect tribute to the 'Little Master' on his fiftieth birthday.;"{""Biography & Autobiography""}";680;;en;http://books.google.com/books/content?id=pAKcAwAAQBAJ&printsec=frontcover&img=1&zoom=1&source=gbs_api
513;5j97XxrtxhMC;https://www.googleapis.com/books/v1/volumes/5j97XxrtxhMC;http://books.google.com/books?id=5j97XxrtxhMC&dq=Sunil+Gavaskar&hl=&cd=2&source=gbs_api;Sunny Days;290;Sunil Gavaskar;Rupa Publications;2012-12-03;;{};264;;en;http://books.google.com/books/content?id=5j97XxrtxhMC&printsec=frontcover&img=1&zoom=1&source=gbs_api
514;oze5BAAAQBAJ;https://www.googleapis.com/books/v1/volumes/oze5BAAAQBAJ;http://books.google.com/books?id=oze5BAAAQBAJ&pg=PT74&dq=Sunil+Gavaskar&hl=&cd=3&source=gbs_api;The Cricket Quiz Book;291;Adam Pearson;Andrews UK Limited;2011-06-24;Did you know that cricket is the second most popular sport in the world and has been an established team sport for centuries, with more than 100 cricket-playing nations now recognised by the International Cricket Council? No doubt those questions haven’t left cricket aficionados remotely stumped, but be prepared to be caught out by the 1,000 leg-breaking quiz questions in this book. Your innings will require you to recall facts and figures relating to every possible aspect of the game of cricket from players to umpires and national to international matches, together with all kinds of trivia, so you could very easily find yourself in a real spin and may need to enlist the help of friends to bail you out before a sneaky Chinaman bowls you over, slips you up or reduces you to a pile of ashes. Whether you find yourself top of the batting order or limping with a square leg, this book, with a fitting foreword by Dickie Bird, contains a wealth of knowledge about the sport that is guaranteed to enthral all cricket fans, and questions that will stimulate fond memories and friendly debates for many an entertaining hour.;{Games};122;;en;http://books.google.com/books/content?id=oze5BAAAQBAJ&printsec=frontcover&img=1&zoom=1&edge=curl&source=gbs_api
515;mLVKwM-zO3UC;https://www.googleapis.com/books/v1/volumes/mLVKwM-zO3UC;http://books.google.com/books?id=mLVKwM-zO3UC&dq=Sunil+Gavaskar&hl=&cd=4&source=gbs_api;Sunil Gavaskar Omnibus;292;Rupa;Rupa Publications;;;{};;3;en;http://books.google.com/books/content?id=mLVKwM-zO3UC&printsec=frontcover&img=1&zoom=1&source=gbs_api
516;PTT4Ah9VsZMC;https://www.googleapis.com/books/v1/volumes/PTT4Ah9VsZMC;http://books.google.com/books?id=PTT4Ah9VsZMC&pg=PT68&dq=Sunil+Gavaskar&hl=&cd=5&source=gbs_api;Great Lives (Vol-I);293;A. K. Kothari;Pustak Mahal;1999-01-24;The well-researched volume remains one of the most authoritative reference guides on the lives of great achievers of all times. Written in simple and lucid language,it offers biographical sketches of great artists, authors, scientists, scholars, spiritual masters, singers, statesmen,royalty, film stars, mystics, politicians, philosophers, thinkers, sportsmen etc. for ready reference.An ideal companion in leisure time, it also has great educational value as we learn many fascinating details about the lives of great men and women-providing us inspiration to do things differently and more confidently. At times such inspirations have more value than any other motivational factors. When we learn that Edison was a poor boy without any formal schooling, or Faraday was an apprentice at a stationery shop we feel greatly motivated and find a new confidence in ourselves.;{};112;;en;http://books.google.com/books/content?id=PTT4Ah9VsZMC&printsec=frontcover&img=1&zoom=1&edge=curl&source=gbs_api
517;Fq1wdzqhu6kC;https://www.googleapis.com/books/v1/volumes/Fq1wdzqhu6kC;http://books.google.com/books?id=Fq1wdzqhu6kC&pg=PA180&dq=Sunil+Gavaskar&hl=&cd=6&source=gbs_api;Indian Champions;294;Chitra Garg;Rajpal & Sons;2010;Short biography of eminent Indian sportspersons.;{Athletes};379;;en;http://books.google.com/books/content?id=Fq1wdzqhu6kC&printsec=frontcover&img=1&zoom=1&edge=curl&source=gbs_api
519;bLHRBgAAQBAJ;https://www.googleapis.com/books/v1/volumes/bLHRBgAAQBAJ;http://books.google.com/books?id=bLHRBgAAQBAJ&pg=PT95&dq=Sunil+Gavaskar&hl=&cd=8&source=gbs_api;A Million Broken Windows: The Magic and Mystique of Bombay Cricket;296;Makarand Waingankar;HarperCollins Publishers India;2015-01-20;One-third of all of India's international runs have been scored by batsmen who came through the ranks of Bombay cricket. Bombay has won the Ranji Trophy forty times, fifteen of them in a row. Bombay batsmen have scored 461 centuries and fifty-eight double hundreds in the tournament. A Million Broken Windows is the story of how the city of Bombay, almost the birthplace of Indian cricket, has consistently dominated the game of an entire country. It illuminates the various facets of a cricketing culture that is infused with the spirit of the city of Bombay. Replete with anecdotes and analyses, the book discusses various leagues, tournaments, players, the fans and the city to paint a complex picture of the game and of Bombay itself. Makarand Waingankar introduces readers not only to the details of the cricketing story but also to the air of the maidans. The book bears testimony to, and pays tribute to, a sporting story that is truly unparalleled.;"{""Sports & Recreation""}";288;;en;http://books.google.com/books/content?id=bLHRBgAAQBAJ&printsec=frontcover&img=1&zoom=1&edge=curl&source=gbs_api
520;rmOjSQAACAAJ;https://www.googleapis.com/books/v1/volumes/rmOjSQAACAAJ;http://books.google.com/books?id=rmOjSQAACAAJ&dq=Sunil+Gavaskar&hl=&cd=9&source=gbs_api;Indian Test Captains: Sachin Tendulkar, Mohammad Azharuddin, Sunil Gavaskar, Sourav Ganguly, Virender Sehwag, Mahendra Singh Dhoni;297;Source Wikipedia;Books LLC, Wiki Series;2010-05;"Please note that the content of this book primarily consists of articles available from Wikipedia or other free sources online. Pages: 63. Chapters: Sachin Tendulkar, Mohammad Azharuddin, Sunil Gavaskar, Sourav Ganguly, Virender Sehwag, Mahendra Singh Dhoni, Rahul Dravid, Kapil Dev, Anil Kumble, Ravi Shastri, Polly Umrigar, Bishan Singh Bedi, Chandu Borde, Maharajkumar of Vizianagram, Dilip Vengsarkar, Vijay Hazare, Srinivasaraghavan Venkataraghavan, Iftikhar Ali Khan Pataudi, Krishnamachari Srikkanth, Gundappa Viswanath, Vinoo Mankad, Mansoor Ali Khan Pataudi, C. K. Nayudu, Hemu Adhikari, Ajit Wadekar, Lala Amarnath, Datta Gaekwad, Nari Contractor, Pankaj Roy, Ghulam Ahmed, Gulabrai Ramchand. Excerpt: Sachin Ramesh Tendulkar ) (Marathi: born 24 April 1973) is an Indian cricketer widely regarded as one of the greatest batsmen in the history of cricket. He is the leading run-scorer and century maker in Test and one-day international cricket. He is the only male player to score a double century in the history of ODI cricket. In 2002, just 12 years into his career, Wisden ranked him the second greatest Test batsman of all time, behind Donald Bradman, and the second greatest one-day-international (ODI) batsman of all time, behind Viv Richards. In September 2007, the Australian leg spinner Shane Warne rated Tendulkar as the greatest player he has played with or against. Tendulkar was an integral part of the 2011 Cricket World Cup winning Indian team at the later part of his career, his first such win in six World Cup appearances for India. Tendulkar is the first and the only player in Test Cricket history to score fifty centuries, and the first to score fifty centuries in all international cricket combined; he now has 99 centuries in international cricket. On 17 October 2008, when he surpassed Brian Lara's record for the most runs scored in Test cricket, he also became the first batsman to score 12,000, 13,000 and 14,000 runs in that form of the game, having also ...";{};260;;en;
521;rTYIAQAAQBAJ;https://www.googleapis.com/books/v1/volumes/rTYIAQAAQBAJ;http://books.google.com/books?id=rTYIAQAAQBAJ&pg=PT171&dq=Sunil+Gavaskar&hl=&cd=10&source=gbs_api;Pitch It!;298;Dev Prasad;Random House India;2013-10-15;Pitch It! is an innovative and delightful book consisting of enthralling anecdotes linking top cricketing giants and corporate moguls that will act as a catalyst for professionals to soar to top echelons in their respective fields. Peppered with fascinating case studies from an eclectic spectrum of industries ranging from IT, Consumer Goods, Automotive, Aerospace, Banking, Petrochemicals, and Food & Beverages, Pitch It! provides the essential blueprint for creating and sustaining winning organizations. ‘Pitch It! is a great compilation of winning strategies... Greatly enjoyed following winning habits through the lenses of two different arenas I love’—K Srinivas, President, Consumer Business, Bharti Airtel Limited ‘A great assembly of vignettes of the game and its relevance in business. Loved each chapter...makes you want to go back to it each time. Unputdownable!’—S.V. Nathan, Director, Deloitte Pitch It! has a foreword by Kiran Mazumdar-Shaw and epilogue by former Indian cricketer & coach, Venkatesh Prasad. Dev prasad’s debut book KRISHNA: A Journey Through the Lands & Legends of Krishna was longlisted for 2010 Vodafone Crossword Award.;"{""Literary Collections""}";389;;en;http://books.google.com/books/content?id=rTYIAQAAQBAJ&printsec=frontcover&img=1&zoom=1&edge=curl&source=gbs_api
522;wJf6NuadRWEC;https://www.googleapis.com/books/v1/volumes/wJf6NuadRWEC;http://books.google.com/books?id=wJf6NuadRWEC&pg=PA42&dq=Sunil+Gavaskar&hl=&cd=11&source=gbs_api;Indian Cricket Controversies;299;K.R. Wadhwaney;Diamond Pocket Books (P) Ltd.;2003*;;{Cricket};392;;en;http://books.google.com/books/content?id=wJf6NuadRWEC&printsec=frontcover&img=1&zoom=1&edge=curl&source=gbs_api
523;6gyAAgAAQBAJ;https://www.googleapis.com/books/v1/volumes/6gyAAgAAQBAJ;http://books.google.com/books?id=6gyAAgAAQBAJ&pg=PA181&dq=Sunil+Gavaskar&hl=&cd=12&source=gbs_api;The Magic of Indian Cricket;300;Mihir Bose;Routledge;2006-04-18;In the last twenty years, Indian cricket has been transformed. With the arrival of global television networks, mass-media coverage and multinational sponsors, cricket has become big business and India has become the economic driving force in the world game. For the first time a developing country has become a major player in the international sports arena. This fully updated and revised edition of Mihir Bose's classic history is a unique account of the Indian cricket phenomenon. Drawing on a combination of extensive research and personal experience, Bose traces the development of the Indian game from its beginnings as a colonial pastime to its coming of age as a national passion and now a global commercial powerhouse. This illuminating study reveals Indian cricket's central place in modern India’s identity, culture and society. Insightful, honest and challenging, Bose tackles the myths and controversies of Indian cricket. He considers the game in terms of race, caste, politics, national consciousness and ambition, money, celebrity and the media, evoking all the unpredictability, frustration and glory that is the magic of Indian cricket.;"{""Social Science""}";304;;en;http://books.google.com/books/content?id=6gyAAgAAQBAJ&printsec=frontcover&img=1&zoom=1&edge=curl&source=gbs_api
524;NDEEAAAAMBAJ;https://www.googleapis.com/books/v1/volumes/NDEEAAAAMBAJ;http://books.google.com/books?id=NDEEAAAAMBAJ&pg=PA62&dq=Sunil+Gavaskar&hl=&cd=13&source=gbs_api;Outlook;;;;2008-11-03;;{};47;;en;http://books.google.com/books/content?id=NDEEAAAAMBAJ&printsec=frontcover&img=1&zoom=1&edge=curl&source=gbs_api
525;Y3PwZlwb4S4C;https://www.googleapis.com/books/v1/volumes/Y3PwZlwb4S4C;http://books.google.com/books?id=Y3PwZlwb4S4C&pg=PA27&dq=Sunil+Gavaskar&hl=&cd=14&source=gbs_api;Millennium Sports Quiz Book;302;Ed.. Sachin Singhal;Diamond Pocket Books (P) Ltd.;;;{};168;;en;http://books.google.com/books/content?id=Y3PwZlwb4S4C&printsec=frontcover&img=1&zoom=1&edge=curl&source=gbs_api
526;e4v8068mxXsC;https://www.googleapis.com/books/v1/volumes/e4v8068mxXsC;http://books.google.com/books?id=e4v8068mxXsC&pg=PT10&dq=Sunil+Gavaskar&hl=&cd=15&source=gbs_api;Competition Science Vision;;;;2009-03;Competition Science Vision (monthly magazine) is published by Pratiyogita Darpan Group in India and is one of the best Science monthly magazines available for medical entrance examination students in India. Well-qualified professionals of Physics, Chemistry, Zoology and Botany make contributions to this magazine and craft it with focus on providing complete and to-the-point study material for aspiring candidates. The magazine covers General Knowledge, Science and Technology news, Interviews of toppers of examinations, study material of Physics, Chemistry, Zoology and Botany with model papers, reasoning test questions, facts, quiz contest, general awareness and mental ability test in every monthly issue.;{};107;;en;http://books.google.com/books/content?id=e4v8068mxXsC&printsec=frontcover&img=1&zoom=1&edge=curl&source=gbs_api
527;ZeJ-8Xhj17MC;https://www.googleapis.com/books/v1/volumes/ZeJ-8Xhj17MC;http://books.google.com/books?id=ZeJ-8Xhj17MC&pg=RA1-PA95&dq=Sunil+Gavaskar&hl=&cd=16&source=gbs_api;Study Package For Clat;304;Bharadwaj;Tata McGraw-Hill Education;;;{};;;en;http://books.google.com/books/content?id=ZeJ-8Xhj17MC&printsec=frontcover&img=1&zoom=1&edge=curl&source=gbs_api
528;FLNZJSvQbl8C;https://www.googleapis.com/books/v1/volumes/FLNZJSvQbl8C;http://books.google.com/books?id=FLNZJSvQbl8C&pg=PA14&dq=Sunil+Gavaskar&hl=&cd=17&source=gbs_api;Reading Comprehension for the CAT: A Winning Approach by an IIM Alumnus;;;Pearson Education India;;;{};;;en;http://books.google.com/books/content?id=FLNZJSvQbl8C&printsec=frontcover&img=1&zoom=1&edge=curl&source=gbs_api
529;Wa8olLPC2PoC;https://www.googleapis.com/books/v1/volumes/Wa8olLPC2PoC;http://books.google.com/books?id=Wa8olLPC2PoC&pg=PA28&dq=Sunil+Gavaskar&hl=&cd=18&source=gbs_api;Sensational Sachin;306;Lokesh Thani;Diamond Pocket Books (P) Ltd.;1999;Biography of Sachin Tendulkar, b. 1973, cricket player from India.;{Cricket};126;5;en;http://books.google.com/books/content?id=Wa8olLPC2PoC&printsec=frontcover&img=1&zoom=1&edge=curl&source=gbs_api
530;QG5pCgAAQBAJ;https://www.googleapis.com/books/v1/volumes/QG5pCgAAQBAJ;http://books.google.com/books?id=QG5pCgAAQBAJ&pg=PT32&dq=Sunil+Gavaskar&hl=&cd=19&source=gbs_api;Dressing Room;307;Abhishek Dubey;Diamond Pocket Books Pvt Ltd;;Born on 4th August, 1976, Abhishek Kumar Dubey comes from a small town, Jasidih in Jharkhand. Right from his childhood, he wanted to lead a different life and in this pursuit he came to Delhi. Abhishek was a north zone topper in 10+2(CBSE) and a Hansraj College topper in both BA and MA(History). Freelancing since his college days, he started his journalistic career with NDTV. In NDTV, he came up with one of the most successful sports shows like Olympics 2004 and Chunautee 2004-2006. After working with NDTV for 6 years, he joined IBN 7. A regular contributor on sports issues in different magazines and newspapers. Abhishek is also a guest faculty for several mass media institutes. This book contains the inside story of the Indian dressing room along with some unknown cricketing incidents on and off the field. - What Guru Greg said to Sourav Ganguly in the team bus after the Delhi test. - First information of BCCI's charges against Jagmohan Dalmiya. - The rise and fall of two bengal tigers, who were so near but eventually turned out to be so far, in entirely transforming the Indian cricket.;{};172;;en;http://books.google.com/books/content?id=QG5pCgAAQBAJ&printsec=frontcover&img=1&zoom=1&edge=curl&source=gbs_api
531;rZMsRkKHeVAC;https://www.googleapis.com/books/v1/volumes/rZMsRkKHeVAC;http://books.google.com/books?id=rZMsRkKHeVAC&pg=PA9&dq=Sunil+Gavaskar&hl=&cd=20&source=gbs_api;Cricket At Fever Pitch;308;Khalid A-H Ansari;Popular Prakashan;2006;;{Cricket};288;;en;http://books.google.com/books/content?id=rZMsRkKHeVAC&printsec=frontcover&img=1&zoom=1&edge=curl&source=gbs_api
532;rL1BTZ5GZ9YC;https://www.googleapis.com/books/v1/volumes/rL1BTZ5GZ9YC;http://books.google.com/books?id=rL1BTZ5GZ9YC&pg=PA85&dq=Sunil+Gavaskar&hl=&cd=21&source=gbs_api;How To Win Kaun Banega Crorepati;309;Biswaroop Roy Chowdhury;Diamond Pocket Books (P) Ltd.;;;{};184;3.5;en;http://books.google.com/books/content?id=rL1BTZ5GZ9YC&printsec=frontcover&img=1&zoom=1&edge=curl&source=gbs_api
