id;google_id;json_volume;previewlink;title;author_id;author_name;publisher;publisherdate;description;categories;pages;rating;language;image
88;oIRClVXxXxcC;https://www.googleapis.com/books/v1/volumes/oIRClVXxXxcC;http://books.google.com/books?id=oIRClVXxXxcC&printsec=frontcover&dq=Angels+and+Demons&hl=&cd=13&source=gbs_api;X-Force Vol. 1;57;Craig Kyle;Marvel Entertainment;2009-01-28;There are lines that the X-Men have sworn never to cross. But after the shocking events of Messiah CompleX, Cyclops realizes that some enemies need to be dealt with permanently - and the X-Men can never know about it! Enter Wolverine, Warpath, X-23, and Wolfsbane - X-Force! Collects X-Force (2008) #1-6.;"{""Comics & Graphic Novels""}";144;4.5;en;http://books.google.com/books/content?id=oIRClVXxXxcC&printsec=frontcover&img=1&zoom=1&edge=curl&source=gbs_api
89;GXznEnKwTdAC;https://www.googleapis.com/books/v1/volumes/GXznEnKwTdAC;http://books.google.com/books?id=GXznEnKwTdAC&pg=PA480&dq=Angels+and+Demons&hl=&cd=14&source=gbs_api;Angels & Demons - Movie Tie-In;28;Dan Brown;Simon and Schuster;2009-03-31;The murder of a world-famous physicist raises fear that the Illuminati are operating again after centuries of silence, and religion professor Robert Langdon is called in to assist with the case. By the author of Digital Fortress. Reprint.;{Fiction};496;4.5;en;http://books.google.com/books/content?id=GXznEnKwTdAC&printsec=frontcover&img=1&zoom=1&edge=curl&source=gbs_api
90;w1y9AzctXscC;https://www.googleapis.com/books/v1/volumes/w1y9AzctXscC;http://books.google.com/books?id=w1y9AzctXscC&pg=PA145&dq=Angels+and+Demons&hl=&cd=15&source=gbs_api;Spirits, Angels, Demons, and Gods;58;Don Little;Dorrance Publishing;2010-02-16;;{Religion};532;;en;http://books.google.com/books/content?id=w1y9AzctXscC&printsec=frontcover&img=1&zoom=1&edge=curl&source=gbs_api
91;-66XBgAAQBAJ;https://www.googleapis.com/books/v1/volumes/-66XBgAAQBAJ;http://books.google.com/books?id=-66XBgAAQBAJ&pg=PA95&dq=Angels+and+Demons&hl=&cd=16&source=gbs_api;Angels and Demons;59;Ron Phillips;Charisma Media;2015-04-07;OPEN YOUR EYES to a WHOLE NEW WORLD Beyond our normal senses there lies another dimension more real and lasting than anything we can imagine. It is a world populated by both angels and demons, and it is essential that we understand it. In Angels and Demons Ron Phillips brings you a definitive guide to these supernatural beings, providing a basic training manual in the war between good and evil. We are not powerless against the forces of darkness, but to survive we must know both our allies and our real enemies. Divided into two parts for easy understanding, sections include: ANGELS * Where they originated * How they operate * How they are activated DEMONS * Tracing their history * Understanding their dynasty * Enforcing and maintaining the victory over them;{Religion};288;;en;http://books.google.com/books/content?id=-66XBgAAQBAJ&printsec=frontcover&img=1&zoom=1&edge=curl&source=gbs_api
92;tE9JAwAAQBAJ;https://www.googleapis.com/books/v1/volumes/tE9JAwAAQBAJ;http://books.google.com/books?id=tE9JAwAAQBAJ&pg=PT97&dq=Angels+and+Demons&hl=&cd=17&source=gbs_api;How to See the Holy Spirit, Angels, and Demons;60;Gordon James Klingenschmitt;Wipf and Stock Publishers;2013-12-01;"Are God, angels, and demons really invisible? Or can the spirits be seen with human eyes, through the lens of Church Ethics? The gift of discerning of spirits is indispensible to the study of church ethics. Ignatius of Loyola, founder of the Society of Jesus (Jesuits), wrote two sets of Rules for Discerning of Spirits in his Spiritual Exercises in the early 1500s. He taught how the church can receive from God the gift to see otherwise invisible angels, demons, and the Holy Spirit. Ignatius' views were influenced by John Cassian, Jacobus de Voragine, Ludolph of Saxony, and Thomas a Kempis. Ignatius' Rules are exegeted in dialogue with contemporary scholars Karl Rahner, Hugo Rahner, Piet Penning de Vries, Jules Toner, and Timothy Gallagher, and applied to one study of ecclesial ethics in the narrative theology of Samuel Wells. A four-step Ignatian ""pneumato-ethical method"" is developed, which any analyst can follow to see the spirits, by consolation/desolation, consent, manifestation, and pneumato-ethics. This method revolutionizes how we study ecclesiology, soteriology, missiology/world religions, liturgy, worship, Eucharist, hermeneutics, homiletics, pastoral counseling, church history, and politics. The spirits are not invisible at all. They can be clearly discerned through the lens of ecclesial ethics.";{Religion};290;;en;http://books.google.com/books/content?id=tE9JAwAAQBAJ&printsec=frontcover&img=1&zoom=1&edge=curl&source=gbs_api
93;ENRoOFpfF9kC;https://www.googleapis.com/books/v1/volumes/ENRoOFpfF9kC;http://books.google.com/books?id=ENRoOFpfF9kC&pg=PT20&dq=Angels+and+Demons&hl=&cd=18&source=gbs_api;When Angels Cook, Demons Stew: The Warfare of Angels and Demons;61;Dr. M. June Craig;PublishAmerica;;;{};;;en;http://books.google.com/books/content?id=ENRoOFpfF9kC&printsec=frontcover&img=1&zoom=1&edge=curl&source=gbs_api
94;9u1qqCCgCKAC;https://www.googleapis.com/books/v1/volumes/9u1qqCCgCKAC;http://books.google.com/books?id=9u1qqCCgCKAC&pg=PA105&dq=Angels+and+Demons&hl=&cd=19&source=gbs_api;Between Angels & Demons;62;Emma Bowes-Romanelli;Next Century Books Limited;2004-09;;{Leukemia};22;;en;http://books.google.com/books/content?id=9u1qqCCgCKAC&printsec=frontcover&img=1&zoom=1&edge=curl&source=gbs_api
95;eKW5wyHzrUsC;https://www.googleapis.com/books/v1/volumes/eKW5wyHzrUsC;http://books.google.com/books?id=eKW5wyHzrUsC&pg=PA168&dq=Angels+and+Demons&hl=&cd=20&source=gbs_api;Colandra's Crusade - Angels and Demons Collide;63;Susie Pilkington-Wood;Fingerpress;2012-07-01;Angels and demons collide in this epic new series. Last year alone, over 300 coma patients' souls went wandering. Colandra has the opposite problem: he's lost his body. Somewhere, he believes, it's locked in a coma. And the demon Lars will do everything in his power to stop Colandra taking it. But Lars is so busy with his plans of world domination that he fails to notice the troupe of angels lining up to stop him - and his own servant, Vorce, quietly gaining power to achieve his own plan - to take over the universe. Meanwhile Colandra's spirit is reintroduced to his soulmate Michelle from a previous life, and together they resolve to thwart Lars' and Vorce's plans - and in the process reunite Colandra with his body.;{Fiction};300;;en;http://books.google.com/books/content?id=eKW5wyHzrUsC&printsec=frontcover&img=1&zoom=1&edge=curl&source=gbs_api
96;2hz1AwAAQBAJ;https://www.googleapis.com/books/v1/volumes/2hz1AwAAQBAJ;http://books.google.com/books?id=2hz1AwAAQBAJ&pg=PA12&dq=Angels+and+Demons&hl=&cd=21&source=gbs_api;Naming Ceremony's Art Gallery Magazine: Angels & Demons;64;Naming Ceremony Gallery;Lulu.com;;;{};;;en;http://books.google.com/books/content?id=2hz1AwAAQBAJ&printsec=frontcover&img=1&zoom=1&edge=curl&source=gbs_api
241;GxR2kyy7THUC;https://www.googleapis.com/books/v1/volumes/GxR2kyy7THUC;http://books.google.com/books?id=GxR2kyy7THUC&printsec=frontcover&dq=H.G.Wells&hl=&cd=8&source=gbs_api;H.G. Wells Under Revision;165;Patrick Parrinder;Associated University Presse;1990;Dissatisfied with her relationship with her boyfriend, Constance Wechselburger, a graduate film student, embarks on a disheartening, confusing quest in search of her vision of the ideal intellectual mate.;"{""Literary Collections""}";263;5;en;http://books.google.com/books/content?id=GxR2kyy7THUC&printsec=frontcover&img=1&zoom=1&edge=curl&source=gbs_api
69;5mtwPQAACAAJ;https://www.googleapis.com/books/v1/volumes/5mtwPQAACAAJ;http://books.google.com/books?id=5mtwPQAACAAJ&dq=Dan+Brown&hl=&cd=34&source=gbs_api;The Guide to Dan Brown's The Solomon Key;42;Greg Taylor;Devorss Publications;2005;The massive success of Dan Brown's The Da Vinci Code has readers eagerly awaiting his next novel, The Solomon Key. Using clues left by Brown in interviews, on his website, and on the cover of The Da Vinci Code, Greg Taylor takes you on an unprecedented tour of the new book before it is even released. The Guide to Dan Brown's The Solomon Key explores the topics likely to be included in Brown's next novel - including the hidden history of Washington, D.C., Freemasonry, and even the Ku Klux Klan - to give you a better understanding of the concepts behind the book. With no spoilers, this is the essential primer for The Solomon Key. Book jacket.;"{Body,""Mind & Spirit""}";183;;en;http://books.google.com/books/content?id=5mtwPQAACAAJ&printsec=frontcover&img=1&zoom=1&source=gbs_api
70;3vxqLwEACAAJ;https://www.googleapis.com/books/v1/volumes/3vxqLwEACAAJ;http://books.google.com/books?id=3vxqLwEACAAJ&dq=Dan+Brown&hl=&cd=35&source=gbs_api;Bath Then and Now;28;Dan Brown;History PressLtd;2013-03-01;Bath is one of the most beautiful cities in England. Sleepy Georgian squares, flanked by long colonnades and dotted with green spaces, give the visitor or resident the feeling that nothing much has changed since Jane Austen herself walked the streets. This book, packed with full-color photography by professional photographer Dan Brown and containing rare archive views from the enormous Bath in Time collection, seeks to discover how much has really changed in the heart of the city. Some of these scenes will be familiar, but many more will surprise and delight the reader.;{History};96;;en;http://books.google.com/books/content?id=3vxqLwEACAAJ&printsec=frontcover&img=1&zoom=1&source=gbs_api
71;NTj1AgAAQBAJ;https://www.googleapis.com/books/v1/volumes/NTj1AgAAQBAJ;http://books.google.com/books?id=NTj1AgAAQBAJ&pg=PA48&dq=Dan+Brown&hl=&cd=36&source=gbs_api;Secrets of Inferno;43;Dan Burstein;Story Plant, The;2013-09-24;SECRETS OF INFERNO is a reader's guide to the journey Dan Brown took us all on in INFERNO. The book gives readers the “back story” on particular plot points, Dante references, symbols, historical events, philosophy, art, music, and architectural works that Brown wrapped into his story. It is also an intellectually enriching, intriguing, fresh and fun look at Dante, THE DIVINE COMEDY, the world of ideas circulating in Florence on the cusp of the Renaissance, and the relevance of those ideas to our lives and our world today. Dan Burstein and Arne de Keijzer are the world's leading experts on Dan Brown's fiction. Beginning with their path-breaking SECRETS OF THE CODE, which spent six months on the New York Times bestseller list in 2004, and continuing through four other guidebooks to Dan Brown's fiction (as well as three film documentaries and two special editions of US News), Burstein and de Keijzer have sold more than three million copies of Dan Brown-related commentaries in more than thirty languages. In the wake of each Dan Brown title over the last decade, the media (from the History Channel to CNN to MSNBC to USA Today to the Washington Post) have turned to Burstein and de Keijzer for interpretations of Dan Brown's books, decoding of the hidden symbols and ciphers, explanations of the controversies, and thoughtful separation of fact from fiction in these supremely popular stories that somehow always manage to fascinate our culture well beyond the bounds of their pop fiction genre. The ultimate guide for any Dan Brown fan, SECRETS OF INFERNO is entertaining, thought-provoking, and will make the experience of reading INFERNO richer than you ever imagined. Contributors include: Teodolinda Barolini, Da Ponte Professor of Italian, Columbia University Steven Botterill, Associate Professor of Italian Studies, University of California, Berkeley Jamais Cascio, Distinguished Fellow, Institute for the Future and Senior Fellow, Institute for Ethics and Emerging Technologies Joel E. Cohen, Abby Rockefeller Mauzé Professor of Populations at The Rockefeller University and Professor of Populations at the Earth Institute of Columbia University William Cook, Distinguished Teaching Professor of History (Emeritus), State University of New York, Geneseo Alison Cornish, Professor of Italian, Romance Languages, and Literatures department, University of Michigan Paul Ehrlich, Bing Professor of Population Studies, Stanford University, president of Stanford’s Center for Conservation Biology, and author of The Population Bomb Glenn W. Erickson, Professor of Philosophy, Universidade Federal do Rio Grande do Norte (Brazil) Laurie Garrett, Senior Fellow for Global Health, Council on Foreign Relations and author of The Coming Plague Cheryl Helm, Dan Brown codes and puzzles expert Giuseppe Mazzotta, Sterling Professor of Humanities for Italian, Yale University Julie O’Connor, Fine art photographer and photojournalist David Orban, Futurist, CEO of Dotsub, and former chairman of Humanity+ David A. Shugarts, Investigative reporter, author of Secrets of the Widow’s Son, and contributing editor to the Secrets series Gregory Stock, Biophysicist, biotech entrepreneur, and founding director of the Program on Medicine, Technology and Society at UCLA’s School of Medicine Natasha Vita-More, Chairman, Board of Directors of Humanity+ and author of the “Transhumanist Manifesto”;"{""Literary Criticism""}";192;4;en;http://books.google.com/books/content?id=NTj1AgAAQBAJ&printsec=frontcover&img=1&zoom=1&edge=curl&source=gbs_api
72;NAuQfVNPLVkC;https://www.googleapis.com/books/v1/volumes/NAuQfVNPLVkC;http://books.google.com/books?id=NAuQfVNPLVkC&pg=PA291&dq=Dan+Brown&hl=&cd=37&source=gbs_api;Die Wissenschaft bei Dan Brown;44;Joachim Körber;John Wiley & Sons;2009;"Geheime Zirkel, die Vermischung von Religion und Kunst, verschlüsselte Botschaften, geheimnisvolle Pyramiden, der Orden der Templer, das Opus Dei und mysteriöse Antimaterie - Dan Browns Romane verwandeln die Welt häufig in einen düsteren Ort voller Rätsel, Verschwörung und dunkler Theorien. Doch was ist dran an den Schreckensszenarien um Kirche, Staat und Politik? Waren Jesus und Maria Magdalena tatsächlich ein Paar? Was verbirgt sich hinter den Gemälden Leonardo da Vincis? Und was findet sich unter der Pyramide des Louvre? Das Gesamtwerk Dan Browns bleibt die Antwort schuldig und überlässt es häufig der Einschätzung seiner Leser zwischen Dichtung und Wahrheit zu unterscheiden. ""Die Wissenschaft bei Dan Brown"" schafft Abhilfe und spürt diesen Fragen nach. Dabei beschäftigt sich der Autor Joachim Körber nicht nur mit den einzelnen Büchern Dan Browns, sondern begibt sich in den verschiedenen Wissenschaftsdisziplinen auf Spurensuche. Er reist zu den Quellen der Romane und löst in der Verbindung von Geschichte, Literatur, Theologie und Naturwissenschaften die Rätsel um allerhand mysteriöse Mächte.";{};306;;de;http://books.google.com/books/content?id=NAuQfVNPLVkC&printsec=frontcover&img=1&zoom=1&edge=curl&source=gbs_api
73;6dlFc4iwbuIC;https://www.googleapis.com/books/v1/volumes/6dlFc4iwbuIC;http://books.google.com/books?id=6dlFc4iwbuIC&printsec=frontcover&dq=Dan+Brown&hl=&cd=38&source=gbs_api;Communicating Design;45;Dan M. Brown;New Riders;2010-09-15;Successful web design teams depend on clear communication between developers and their clients—and among members of the development team. Wireframes, site maps, flow charts, and other design diagrams establish a common language so designers and project teams can capture ideas, track progress, and keep their stakeholders informed. In this all new edition of Communicating Design, author and information architect Dan Brown defines and describes each deliverable, then offers practical advice for creating the documents and using them in the context of teamwork and presentations, independent of methodology. Whatever processes, tools, or approaches you use, this book will help you improve the creation and presentation of your wireframes, site maps, flow charts, and other deliverables. The book now features: An improved structure comprising two main sections: Design Diagrams and Design Deliverables. The first focuses on the nuts and bolts of design documentation and the second explains how to pull it all together. New deliverable: design briefs, as well as updated advice on wireframes, flow charts, and concept models. More illustrations, to help designers understand the subtle variations and approaches to creating design diagrams. Reader exercises, for those lonely nights when all you really want to do is practice creating wireframes, or for use in workshops and classes. Contributions from industry leaders: Tamara Adlin, Stephen Anderson, Dana Chisnell, Nathan Curtis, Chris Fahey, James Melzer, Steve Mulder, Donna Spencer, and Russ Unger. “As an educator, I have looked to Communicating Design both as a formal textbook and an informal guide for its design systems that ultimately make our ideas possible and the complex clear.” —Liz Danzico, from the Foreword;{Computers};456;;en;http://books.google.com/books/content?id=6dlFc4iwbuIC&printsec=frontcover&img=1&zoom=1&edge=curl&source=gbs_api
74;Yn2TTwgPHCcC;https://www.googleapis.com/books/v1/volumes/Yn2TTwgPHCcC;http://books.google.com/books?id=Yn2TTwgPHCcC&dq=Dan+Brown&hl=&cd=39&source=gbs_api;Dan Brown: The Unauthorized Biography;46;Lisa Rogak;Macmillan;2013-05-07;"Traces the life and career of the popular author, from his childhood through his early years of struggle as a writer, and discusses the legal issues that followed the success of ""The Da Vinci Code.""";"{""Biography & Autobiography""}";192;;en;http://books.google.com/books/content?id=Yn2TTwgPHCcC&printsec=frontcover&img=1&zoom=1&source=gbs_api
75;70iXSQAACAAJ;https://www.googleapis.com/books/v1/volumes/70iXSQAACAAJ;http://books.google.com/books?id=70iXSQAACAAJ&dq=Dan+Brown&hl=&cd=40&source=gbs_api;Phillips Exeter Academy Faculty;47;Books Llc;Books LLC, Wiki Series;2010-05;"Please note that the content of this book primarily consists of articles available from Wikipedia or other free sources online. Pages: 23. Chapters: Frederick Buechner, Dan Brown, Michael S. Greco, T. A. Dwight Jones, Winthrop Jordan, Francis Bowen, George Lyman Kittredge, Jeffrey Harrison, Joseph Gibson Hoyt, Alexander Hill Everett, Michael Golay, Gwynneth Coogan, Donald B. Cole, Benjamin Abbot, Richard G. Brown, Ebenezer Adams, H. Hamilton ""Hammy"" Bissell, Thomas Hassan, David P. Robbins, Stephen G. Kurtz. Excerpt: (Carl) Frederick Buechner is an American writer and theologian. Born July 11, 1926 in New York City, he is an ordained Presbyterian minister and the author of more than thirty published books thus far. His work encompasses different genres, including fiction, autobiography, essays and sermons, and his career has spanned six decades. Buechner's books have been translated into many languages for publication around the world. He is best known for his works A Long Day's Dying (his first work, published in 1950); The Book of Bebb, a tetralogy based on the character Leo Bebb published in 1977; Godric, a first person narrative of the life of the medieval saint, and a finalist for the Pulitzer Prize in 1981; Brendan, a second novel narrating a saint's life, published in 1987; Listening to Your Life: Daily Meditations with Frederick Buechner (1992); and his autobiographical works The Sacred Journey (1982), Now and Then (1983), Telling Secrets (1991), and The Eyes of the Heart: Memoirs of the Lost and Found (1999). He has been called ""Major talent"" and .."".a very good writer indeed"" by the New York Times, and ""one of our most original storytellers"" by USA Today. Annie Dillard (Pulitzer Prize-winning author of Pilgrim at Tinker Creek) says: ""Frederick Buechner is one of our finest writers."" Buechner's work has often been praised for its ability to inspire readers to see the grace in their daily lives. As stated in the London Free Press, ""He is one of our great n...";{};88;;en;
86;d5xgYw4Ts0gC;https://www.googleapis.com/books/v1/volumes/d5xgYw4Ts0gC;http://books.google.com/books?id=d5xgYw4Ts0gC&dq=Angels+and+Demons&hl=&cd=11&source=gbs_api;Angels And Demons;28;Dan Brown;Random House;2009-05-14;Contains a sneak preview of Inferno, Dan Brown’s astonishing new Robert Langdon thriller. CERN Institute, Switzerland: a world-renowned scientist is found brutally murdered with a mysterious symbol seared onto his chest. The Vatican, Rome: the College of Cardinals assembles to elect a new pope. Somewhere beneath them, an unstoppable bomb of terrifying power relentlessly counts down to oblivion. In a breathtaking race against time, Harvard professor Robert Langdon must decipher a labyrinthine trail of ancient symbols if he is to defeat those responsible - the Illuminati, a secret brotherhood presumed extinct for nearly four hundred years, reborn to continue their deadly vendetta against their most hated enemy, the Catholic Church.;{Fiction};624;4.5;en;http://books.google.com/books/content?id=d5xgYw4Ts0gC&printsec=frontcover&img=1&zoom=1&source=gbs_api
36;N_2gqkJhnX0C;https://www.googleapis.com/books/v1/volumes/N_2gqkJhnX0C;http://books.google.com/books?id=N_2gqkJhnX0C&printsec=frontcover&dq=Dan+Brown&hl=&cd=1&source=gbs_api;Angels & Demons;28;Dan Brown;Simon and Schuster;2006;"World-renowned Harvard symbologist Robert Langdon is summoned to a Swiss research facility to analyze a cryptic symbol seared into the chest of a murdered physicist. What he discovers is unimaginable; a deadly vendetta against the Catholic Church by a cen";{Anti-Catholicism};572;4;en;http://books.google.com/books/content?id=N_2gqkJhnX0C&printsec=frontcover&img=1&zoom=1&edge=curl&source=gbs_api
37;SeIalgEACAAJ;https://www.googleapis.com/books/v1/volumes/SeIalgEACAAJ;http://books.google.com/books?id=SeIalgEACAAJ&dq=Dan+Brown&hl=&cd=2&source=gbs_api;Inferno;28;Dan Brown;Random House Large Print;2013;In the heart of Italy, Harvard professor of symbology, Robert Langdon, is drawn into a harrowing world centered on one of history's most enduring and mysterious literary masterpieces … Dante's Inferno. Against this backdrop, Langdon battles a chilling adversary and grapples with an ingenious riddle. By the author of The Da Vinci Code. (general fiction). Simultaneous.;{Fiction};730;4;en;http://books.google.com/books/content?id=SeIalgEACAAJ&printsec=frontcover&img=1&zoom=1&source=gbs_api
38;nXrxGCVd9UoC;https://www.googleapis.com/books/v1/volumes/nXrxGCVd9UoC;http://books.google.com/books?id=nXrxGCVd9UoC&dq=Dan+Brown&hl=&cd=3&source=gbs_api;Angels and Demons;28;Dan Brown;Random House;2013-03-25;CERN Institute, Switzerland: a world-renowned scientist is found brutally murdered with a mysterious symbol seared onto his chest. The Vatican, Rome: the College of Cardinals assembles to elect a new pope. Somewhere beneath them, an unstoppable bomb of terrifying power relentlessly counts down to oblivion. In a breathtaking race against time, Harvard professor Robert Langdon must decipher a labyrinthine trail of ancient symbols if he is to defeat those responsible - the Illuminati, a secret brotherhood presumed extinct for nearly four hundred years, reborn to continue their deadly vendetta against their most hated enemy, the Catholic Church.;{Anti-Catholicism};640;3.5;en;http://books.google.com/books/content?id=nXrxGCVd9UoC&printsec=frontcover&img=1&zoom=1&source=gbs_api
39;BjFZ0UQOUCgC;https://www.googleapis.com/books/v1/volumes/BjFZ0UQOUCgC;http://books.google.com/books?id=BjFZ0UQOUCgC&pg=PT213&dq=Dan+Brown&hl=&cd=4&source=gbs_api;Deception Point;28;Dan Brown;Simon and Schuster;2006-03-28;On the eve of a presidential race in which NASA's budget is a pivotal issue, the space agency announces the discovery of an ancient meteorite filled with fossils deep in the Arctic ice.;{Fiction};752;3.5;en;http://books.google.com/books/content?id=BjFZ0UQOUCgC&printsec=frontcover&img=1&zoom=1&edge=curl&source=gbs_api
40;kqPhohQqARkC;https://www.googleapis.com/books/v1/volumes/kqPhohQqARkC;http://books.google.com/books?id=kqPhohQqARkC&pg=PA11&dq=Dan+Brown&hl=&cd=5&source=gbs_api;The Gospel According to Dan Brown;29;Jeff Dunn;David C Cook;2006;"""Using their knowledge of how stories work, Dunn and Bubeck compare the gospel stories of the Bible to Brown's myths. They show that the two worldwiews are worlds apart.""--Inside jacket cover.";{Religion};237;;en;http://books.google.com/books/content?id=kqPhohQqARkC&printsec=frontcover&img=1&zoom=1&edge=curl&source=gbs_api
41;ohZ1wcYifLsC;https://www.googleapis.com/books/v1/volumes/ohZ1wcYifLsC;http://books.google.com/books?id=ohZ1wcYifLsC&dq=Dan+Brown&hl=&cd=6&source=gbs_api;The Da Vinci Code;28;Dan Brown;Anchor;2003-03-18;Featuring an excerpt from Dan Brown’s new novel, Inferno, on sale now. #1 Worldwide Bestseller—More Than 81 Million Copies Sold As millions of readers around the globe have already discovered, The Da Vinci Code is a reading experience unlike any other. Simultaneously lightning-paced, intelligent, and intricately layered with remarkable research and detail, Dan Brown's novel is a thrilling masterpiece—from its opening pages to its stunning conclusion.;{Fiction};400;4;en;http://books.google.com/books/content?id=ohZ1wcYifLsC&printsec=frontcover&img=1&zoom=1&source=gbs_api
